stemming;Sentimen
ganjar pranowo mahfud md gagas solusi inovatif tingkat taraf hidup didik;Positif
ganjar pranowo mahfud md pilih bawa ubah positif negeri;Positif
putus ganjar pranowo mahfud md baju daerah simbol bangga lokal cipta atmosfer positif politik;Positif
berani ganjar pranowo mahfud md bukti ubah nyata langkah konkret lapang;Positif
ganjar pranowo mahfud md harap pilih utama wujud ubah positif nanti;Positif
ganjar pranowo mahfud md kombinasi sempurna peka sosial pimpin milik berani ambil tindak mari wujud indonesia jeno;Positif
ganjar pranowo mahfud md ajak gandeng tangan cipta indonesia cerdas daya saing;Positif
ganjar pranowo mahfud md moga program buka peluang anak muda indonesia;Netral
ganjar pranowo gubernur pelopor ubah positif indonesia adnalef;Positif
visi ganjar pranowo cipta sarjana keluarga miskin langkah maju bawa dampak positif kembang bangsa;Negatif
ganjar pranowo pimpin asal rakyat harap ganjar mahfud bangun indonesia;Negatif
ganjar pranowo mahfud md gambar didik investasi jangka maju bangsa brumbun;Positif
tuju ganjar pranowo mahfud md pimpin milik visi atas miskin alfaruq;Netral
ganjar pranowo mahfud md moga program contoh daerahdaerah atas miskin;Netral
ganjar pranowo mahfud md hadir harap generasi muda indonesia;Positif
ganjar pranowo ajak cipta ubah positif didik;Positif
nasib keluarga miskin ubah bijak didik inklusif tekan ganjar pranowo mahfud md pionir ubah ari;Positif
ganjar pranowo semangat wujud indonesia maju hebat mahfud;Positif
ganjar pranowo solusi cerdas putus rantai miskin akses didik lapis masyarakat bae;Negatif
ganjar pranowo mahfud md harap orang ubah positif rata mari wujud indonesia inklusif;Positif
program vokasi ganjar pranowo investasi cerdas generasi ganjar mahfud terus gerak maju;Positif
ganjar pranowo mahfud md visi atas miskin peluang didik warga negara;Negatif
ganjar pranowo mahfud md pilih cerdas bawa ubah transformasi didik;Positif
program keluarga miskin sarjana slogan komitmen nyata ganjar pranowo mahfud md cipta ubah;Negatif
semangat ganjar pranowo inspirasi dorong ubah positif ganjar mahfud mari juang adil sosial;Positif
keluarga miskin sarjana langkah mantap ganjar pranowo mahfud md maju didik indonesia falkoncol;Negatif
program vokasi ganjar pranowo bukti hasil mahfud md mitra program terap rata indonesia meldamelda;Positif
ganjar pranowo semangat lawan miskin inspirasi ganjar mahfud mari juang adil sosial;Positif
berani ganjar pranowo mahfud md luncur program keluarga miskin sarjana inspirasi kontribusi ubah positif negeri;Negatif
wb tni polri ku qaqaqqaaaqaaaaaaaqaaaaqaaqaqaaaaaaaa;Positif
ganjar pranowo mahfud md kombinasi sempurna bawa ubah positif atas miskin didik mtiaras;Positif
ganjar pranowo mahfud md bawa semangat ubah program didik inklusif mari bersamasama dukung;Netral
inspirasi ganjar pranowo pimpin rakyat rakyat gugah hati mahfud md mari bangun indonesia inklusif adil;Positif
berani ganjar pranowo mahfud md lawan ketidaksetaraan didik inspiratif;Positif
ganjar pranowo subhanallah peleh ini hati lihat mereka adem hebat mahfud;Positif
program vokasi ganjar pranowo bukti investasi didik investasi nila mahfud md investasi luas negeri pinkyuuu;Positif
program vokasi terap ganjar pranowo program solusi nyata kurang anggur miskin sukses ganjar mahfud;Positif
program vokasi ganjar pranowo langkah cerdas hadap tantang ekonomi global mari dukung ganjar mahfud lanjut inisiatif;Positif
ganjar pranowo selamat ganjar semangat maju didik bangsa hebat mahfud;Positif
ganjar pranowo mahfud md bawa harap program keluarga miskin sarjana langkah nyata entas miskin oqhe;Negatif
ganjar pranowo mahfud md pasang harap bawa indonesia arah maju;Netral
silaturahmi ganjar moga bawa menang berkah;Netral
ganjar pranowo mahfud md bawa solusi nyata masalah ketidaksetaraan didik mau;Positif
program nyata ganjar pranowo miskin hadap keluarga indonesia;Negatif
ganjar pranowo pimpin komitmen ubah nasib anakanak miskin didik;Negatif
ganjar pranowo mahfud md moga langkah titik maju didik indonesia;Netral
ganjar pranowo didik hak anak indonesia kecuali;Netral
program vokasi jawa terap ganjar pranowo bukti didik praktis kunci cipta lapis masyarakat terampil ganjar mahfud mari lanjut;Positif
haru dedikasi ganjar pranowo mahfud md peluang untung;Netral
ganjar pranowo bawa semangat ubah tingkat provinsi tingkat nasional program;Netral
ganjar mahfud sedia program mulia tuju keluarga miskin sarjana rakyat pilih ganjar mahfud nomor;Positif
dukung ganjar pranowo mahfud md milik tekad buka pintu sempat didik;Netral
satusatunya calon presiden dekat masyarakat ganjar;Netral
ganjar pranowo buka pintu harap program keluarga miskin sarjana anakanak miskin raih mimpi;Negatif
dukung ganjar pranowo mahfud md pilih jalan didik solusi utama maju bangsa;Positif
jogyakarta dukung ganjar pranowo sepenuhnyaoptimis menang;Positif
inspiratif ganjar pranowo bagi alam pribadi motivasi cipta ubah didik;Positif
ganjar pranowo mahfud md komitmen tingkat sejahtera program keluarga miskin sarjana;Negatif
dukung masyarakat cipta optimisme ganjar pranowo mahfud md pilar ubah positif;Positif
ganjar pranowo motivasi bersamasama lawan miskin didik jalan capai hidup;Negatif
ganjar pranowo bukti dedikasi gubernur dukung bawa tingkat nasional program patut apresiasi;Netral
utami raharjo nah lo bagaimana itu;Netral
alhamdulillah dukung ganjar;Netral
ganjar pranowo mahfud md cipta era anak milik sempat tara raih impi;Netral
ganjar pranowo mahfud md moga indonesia saksi lompat maju program keluarga miskin sarjana;Negatif
program keluarga miskin sarjana cipta peluang ganjar pranowo mahfud md pasang bawa ubah positif indonesia mnu;Negatif
ganjar pranowo mahfud md semangat bawa ubah positif didik kualitas;Positif
ganjar pranowo mahfud md harap moga program hebat bawa ubah anakanak miskin indonesia;Positif
ganjar pranowo mahfud md pimpin rekat satu bangsa;Netral
program keluarga miskin sarjana langkah revolusioner ganjar pranowo mahfud md kombinasi bawa revolusi positif indonesia pratamatho;Negatif
ganjar pranowo mahfud md indonesia milik pimpin erti investasi besar investasi didik;Netral
berani ganjar pranowo lawan miskin didik contoh patut ikut mahfud md mitra kuat lanjut juang naywon;Positif
ganjar pranowo bukti hasil ukur latar ekonomi sempat didik;Positif
semangat juang ganjar pranowo inspirasi serah capai impi ganjar mahfud mari wujud ubah;Netral
dukung ganjar pranowo mahfud md bukti didik kunci ubah;Netral
moga jalin tali silaturahmi;Positif
ganjar pranowo mahfud md bawa semangat upaya tingkat kualitas didik indonesia;Netral
ganjar pranowo mahfud md janji ubah program keluarga miskin sarjana gerak roda ubah;Negatif
sambut tanda ganjar mahfud orang hebat;Positif
ganjar pranowo mahfud md bukti ubah sosial didik rata kualitas;Negatif
hasil program vokasi jawa pimpin ganjar pranowo bukti solusi miskin implementasi efektif mari dukung ganjar mahfud farid;Positif
ganjar pranowo bawa semangat positif cipta program inklusif;Positif
ganjar pranowo contoh nyata didik kunci sukses pribadi bangsa;Positif
pimpin cinta rakyat i love you ganjar;Positif
ganjar pranowo mahfud md komitmen cipta ubah positif sektor didik;Positif
ganjar pranowo bukti alam pribadi kuat cipta ubah positif;Positif
ganjar pranowo mahfud md percaya pimpin bawa ubah positif tanah air;Positif
haru peduli ganjar pranowo muka alam pribadi bantu dejavu;Netral
dukung penuh program keluarga miskin sarjana ganjar pranowo mahfud md langkah bijak sempat tara didik;Positif
ganjar pranowo mahfud md mari bersamasama wujud citacita rang miskin indonesia;Negatif
ganjar pranowo kenang alam bukti didik kunci ubah sosial;Positif
inspirasi ganjar pranowo mahfud md ubah alam pribadi bijak progresif;Positif
ganjar pranowo mahfud md gambar komitmen bawa ubah positif program keluarga miskin sarjana;Negatif
ganjar pranowo bukti alam pribadi sumber inspirasi cipta bijak dampak;Netral
ganjar pranowo keren hebat mahfud;Positif
ganjar pranowo bukti batas raih didik mahfud md indonesia anak milik akses nuren;Netral
sederhana ganjar pranowo kuat sejati ganjar mahfud juang adil makmur;Positif
ganjar pranowo mahfud md moga visi ubah paradigma didik indonesia;Netral
program keluarga miskin sarjana cipta peluang sulit akses ganjar pranowo mahfud md harap negeri;Negatif
ganjar pranowo bawa energi positif cipta sempat didik tara anakanak pandang latar;Positif
ganjar pranowo cipta model pimpin fokus daya masyarakat didik away;Netral
ganjar pranowo ajak ubah dukung program;Netral
menang ganjar pranowo gaspol putus maka;Positif
baju daerah kena ganjar pranowo simbol agam indonesia satu lapis masyarakat;Netral
ganjar pranowo mahfud md program keluarga miskin sarjana bukti pimpin komitmen solusi nyata sosial;Negatif
dukung sepenuh hati ganjar pranowo mahfud md pimpin peduli nasib anakanak miskin;Negatif
ganjar pranowo mahfud md keluarga miskin sarjana peluang emas anakanak miskin;Negatif
ganjar pranowo mahfud md bicara tindak nyata program keluarga miskin sarjana jadi didik prioritas utama;Positif
ganjar pranowo mahfud md pasang paham urgensi lindung konsumen era digital;Netral
ganjar pranowo mahfud md pilih bijak bawa indonesia arah ubah positif lanjut;Positif
dukung penuh ganjar pranowo mahfud md pilih daya didik;Positif
dukung penuh ganjar pranowo mahfud md inisiatif bantu keluarga miskin program keluarga miskin sarjana;Negatif
ganjar pranowo anak nyaman karena orang hebat mahfud;Positif
ganjar pranowo mahfud md pimpin bawa sentuh hangat politik akhirat;Positif
ganjar pranowo mahfud md layak dukung bicara tindak bangsa;Positif
moga ganjar pranowo mahfud md pionir implementasi programprogram progresif indonesia;Netral
presiden republik indonesia ir jokowi basukibtp ahokbasukibtp gibrantweet ganjar pranowo kaesangp bobbynasution hebat mahfud;Positif
ganjar pranowo mahfud md harap program dampak nyata atas didik;Positif
ganjar pranowo mahfud md keluarga miskin sarjana pihak anakanak miskin;Negatif
apa ganjar memang pimpin hebat sosial;Positif
ganjar pranowo bukti baik hati buka jalan ubah;Positif
ganjar pranowo bukti anak keluarga miskin milik potensi mahfud md potensi kembang sejahtera indonesia ourbuddy;Negatif
ganjar pranowo ajak bersamasama bangun negeri didik rata kualitas;Netral
lahan hambalang jadi lahan tani modern;Positif
program keluarga miskin sarjana bukti nyata ganjar pranowo cipta ubah sistemik indonesia;Negatif
ganjar pranowo mahfud md benarbenar hebat jaga arif lokal kena baju daerah tangan pinjol rugi rakyat;Positif
program keluarga miskin sarjana peka ganjar pranowo mahfud md masalah sosial indonesia;Positif
program keluarga miskin sarjana ganjar pranowo mahfud md harap rata akses didik indonesia;Negatif
ganjar pranowo lugas ajak solusi bersamasama ketidaksetaraan didik indonesia;Positif
haru ganjar pranowo manfaat alam pribadi dorong cipta ubah positif tingkat nasional;Positif
program cermin komitmen ganjar pranowo sempat tara;Netral
ganjar pranowo mahfud md tim rancang langkahlangkah konkret rang miskin;Negatif
program keluarga miskin sarjana visi jangka ganjar pranowo mahfud md indonesia;Negatif
ganjar pranowo ajak bersamasama bentuk bangsa cerdas didik wb;Positif
ganjar pranowo ajak peran aktif dukung didik fondasi bangun bangsa;Positif
berani ganjar pranowo mahfud md luncur program serius maju bangsa didik;Negatif
ganjar pranowo bukti anak milik potensi agen ubah;Positif
ganjar pranowo bawa komitmen cetak generasi cerdas program keluarga miskin sarjana mari dukung mahfud;Negatif
ganjar pranowo mahfud md tandem bawa harap anakanak miskin cita cita;Negatif
ganjar pranowo mahfud md tawar visi atas miskin didik langkah positif dukung mbappee;Negatif
ayo lawan miskin hidup semangat ganjar pranowo inspirasi bersamasama kontribusi ubah positif negeri;Positif
inisiatif keluarga miskin sarjana ganjar pranowo harap entas miskin indonesia lar;Negatif
chchotimah jokowi ganjar pranowo realistis beasiswa juta anak miskin program capres belah makan gratis bancak trilyun ladang korupsi giur hebat mahfud;Positif
ganjar pranowo bawa ubah jawa tingkat nasional program didik fokus anakanak miskin;Negatif
ganjar pranowo bawa alam nyata hadap tantang didik indonesia;Positif
ganjar pranowo mahfud md didik kunci ubah positif mari bersamasama dukung visi;Positif
kakakica ganjar pranowo amin moga lancar hebat mahfud;Positif
ganjar pranowo anak hak didik tara pandang status ekonomi;Positif
melihatindo ganjar pranowo nama mas alam ganjar bagus banget masya allah hebat mahfud;Positif
ganjar pranowo gambar didik senjata ampuh lawan ketidaksetaraan;Positif
ganjar pranowo ajak bersamasama lawan miskin pintu gerbang didik;Negatif
jogja karta sultan hebat moga berkah;Positif
dukung ganjar pranowo mahfud md usaha cipta generasi unggul program keluarga miskin sarjana;Positif
program keluarga miskin sarjana ganjar pranowo mahfud md milik visi jangka cipta ubah positif struktur didik indonesia;Negatif
program keluarga miskin sarjana bukti nyata ganjar pranowo peduli anakanak indonesia;Negatif
sukses ganjar pranowo mahfud md rancang program keluarga miskin sarjana langkah atas miskin;Negatif
program capres nomor urut mas ganjar pranowo enggak lanjut tambah baik program sudah;Positif
ganjar pranowo mahfud md hadir solusi inovatif program keluarga miskin sarjana bukti pimpin responsif tuntut zaman;Positif
ganjar pranowo percaya indonesia pimpin program keluarga miskin sarjana bukti ubah;Netral
ganjar pranowo ajak bersamasama pionir rubah paradigma didik indonesia;Positif
dukung penuh ganjar pranowo mahfud md usaha cipta ubah positif keluarga miskin sarjana;Positif
bellamy anut alir salawi salah jokowi;Negatif
utami raharjo semangat ganjar yang iri orang sukses mah;Positif
ganjar pranowo mahfud md hadir visi cipta generasi terus bangsa unggul didik kualitas;Positif
mikuroq ganjar pranowo ganjar moga wujud impi hebat mahfud;Positif
ganjar pranowo bawa semangat adil sosial upaya atas miskin;Negatif
butuh pimpin ganjar pranowo mimpi ubah keras wujud;Negatif
ganjar pranowo motivasi saksi ubah dukung aktif program keluarga miskin sarjana;Negatif
dukung ganjar pranowo mahfud md program keluarga miskin sarjana ubah paradigma didik indonesia;Negatif
ganjar pranowo bawa semangat politik indonesia fokus baik sistem didik;Positif
program inovatif bukti ganjar pranowo mahfud md milik visi maju didik indonesia;Positif
ganjar pranowo mahfud md gambar didik pintu gerbang adab;Netral
ganjar pranowo pimpin milik pandang program keluarga miskin sarjana bukti konkret komitmen didik;Negatif
semangat ganjar pranowo juang didik tara anak patut apresiasi dukung cepat ubah positif cina;Positif
program keluarga miskin sarjana langkah inovatif ganjar pranowo mahfud md entas miskin didik;Negatif
ganjar pranowo mahfud md bawa semangat bukti anak indonesia potensi sosok unggul;Positif
ganjar pranowo mahfud md solusi nyata miskin program keluarga miskin sarjana sukses misi mulia;Positif
ganjar pranowo mahfud md ajak solusi lawan miskin dukung program;Negatif
dukung dorong kuat ganjar pranowo mahfud md wujud program keluarga miskin sarjana;Positif
ganjar pranowo mahfud md moga hasil bawa inspirasi pemimpinpemimpin utama penting masyarakat;Positif
ganjar pranowo bukti anak hak didik kualitas kecuali mari dukung mahfud danial;Netral
ganjar pranowo tempel banget ganjar ganjar asik banget momong sudah kayak anak hebat mahfud;Positif
yang maksud hilir digital;Netral
ganjar pranowo bukti tantang ubah peluang cipta ubah;Netral
ganjar pranowo mahfud md bawa harap anakanak miskin prestasi didik impi jangkau;Negatif
ganjar pranowo mahfud md bawa angin segar program keluarga miskin sarjana perhati nyata nasib keluarga;Positif
inspirasi ganjar pranowo mahfud md prioritas didik kunci maju;Positif
ganjar pranowo mahfud md keluarga miskin sarjana solusi nyata atas ketidaksetaraan didik;Positif
dennysiregar ganjar pranowo bang hebat mahfud;Positif
amin amin allah moga sukses lan gama program ram;Netral
ganjar pranowo pimpin tulus peduli program keluarga miskin sarjana bukti beliau bawa indonesia arah;Positif
semangat ganjar pranowo bukti pimpin jabat dampak positif masyarakat;Positif
inspirasi ganjar pranowo ubah alam pribadi solusi konkret maju bangsa;Positif
ganjar pranowo mahfud md pelopor bijak inklusif hak anak ajar;Positif
ganjar pranowo mahfud md pimpin depan penting rakyat;Positif
dukung ganjar pranowo mahfud md komitmen cipta generasi cerdas daya saing;Positif
program keluarga miskin sarjana gambar komitmen ganjar pranowo cipta ubah sistemik;Negatif
ganjar pranowo contoh nyata individu milik peran bangun bangsa;Positif
alhamdulillah sukses ganjar mahfud program gas pool;Positif
program keluarga miskin sarjana gambar sungguh ganjar pranowo mahfud md atas sosial indonesia triono;Negatif
dukung ganjar pranowo dukung didik adil kualitas;Positif
dukung sepenuh hati ganjar pranowo mahfud md pilih investasi bangsa;Netral
ganjar pranowo heboh enggak lanjut tambah sempurna program perintah;Positif
program keluarga miskin sarjana langkah konkret ganjar pranowo mahfud md peluang tara lapis masyarakat;Negatif
ganjar pranowo cermin pimpin peduli paham masyarakat sedia komitmen cari solusi nyata;Positif
ganjar pranowo mahfud md komitmen hadir anak indonesia;Netral
ganjar pranowo mahfud md tokoh suara adil sosial tindak konkret pinjol rugi;Positif
ganjar pranowo mahfud md pilih cerdas pimpin indonesia ubah positif;Positif
ganjar pranowo juang didik bukti impi wujud didik;Netral
program keluarga miskin sarjana sungguh inspiratif ganjar pranowo mahfud md putus rantai miskin didik kualitas;Negatif
semangat juang ganjar pranowo lawan miskin benarbenar inspirasi mari dukung ubah positif mahfud;Negatif
wb tni polri bangga tni;Positif
ganjar pranowo inspirasi jalan pribadi beliau program sungguh istimewa mari bersamasama dukung visi wujud alfarizie;Positif
program keluarga miskin sarjana langkah revolusioner ganjar pranowo bukti beliau gubernur pimpin paham juang rakyat;Negatif
ganjar pranowo bayang mobil dinas ganjar modifikasi pemuda kece banget hebat mahfud;Positif
ganjar pranowo bukti politis sejati peduli didik;Positif
ganjar pranowo mahfud md ajak satu lawan ketidaksetaraan didik dukung program;Netral
ganjar pranowo mahfud md pilih gambar satu ragam bangsa indonesia;Netral
ganjar pranowo mahfud md terima kasih komitmen tingkat kualitas sumber daya manusia didik;Netral
ganjar pranowo mahfud md duo libat elemen lokal pakai tradisional cermin bangga identitas bangsa;Positif
ganjar pranowo mahfud md ubah mimpi anakanak miskin nyata program;Negatif
program keluarga miskin sarjana gambar ganjar pranowo mahfud md pimpin peduli;Negatif
dukung penuh ganjar pranowo mahfud md implementasi program keluarga miskin sarjana;Negatif
ganjar pranowo mahfud md paham didik kunci utama bangun bangsa maju;Positif
ganjar pranowo buka peluang didik tara guru program keluarga miskin sarjana;Negatif
ganjar pranowo mahfud md bawa misi mulia selamat anakanak miskin;Positif
ganjar pranowo program keren dilanjutin ditambahin baik program perintah;Positif
ganjar pranowo mahfud md harap program keluarga miskin sarjana mari bersamasama dukung ubah;Negatif
dimasgilan fagtng mohmahfudmd salam jari hebat mahfud;Positif
sukses ganjar pranowo mahfud md ubah nasib keluarga miskin program keluarga miskin sarjana;Negatif
ganjar pranowo didik kunci ubah nasib keluarga miskin;Negatif
sosok ganjar pranowo milik semangat dedikasi lawan miskin patut apresiasi dukung penuh minerva;Negatif
ganjar pranowo mahfud md komitmen hadir ubah positif bidang didik indonesia iks;Positif
dukung penuh ganjar pranowo mahfud md bawa ubah positif didik;Positif
agam masyarakat tanggung cermin semangat ganjar pranowo mahfud md bangun satu;Positif
ganjar pranowo bangun fondasi didik landas bangun lanjut;Netral
ganjar pranowo harap program keluarga miskin sarjana inisiatif cipta generasi unggul ubah nasib keluarga miskin;Negatif
ganjar pranowo ajak bersamasama atas tantang miskin akses didik butuh;Negatif
ganjar pranowo lancar sukses urus amin hebat mahfud;Positif
dukung penuh ganjar pranowo mahfud md pilih jalur positif tingkat kualitas didik;Positif
ganjar pranowo bukti bijak didik jembatan atas ketidaksetaraan;Positif
inisiatif ganjar pranowo atas miskin program keluarga miskin sarjana patut acung jempol mari bersamasama wujud impi didik anak;Negatif
ganjar pranowo mahfud md teladan pimpin dedikasi sejahtera rakyat didik;Netral
pilih baju daerah ganjar pranowo mahfud md pesan indonesia maju harga madu kaya budaya khaikem;Positif
ganjar pranowo mahfud md tandem hasil bukti lanjut ekonomi digital inklusif;Netral
ganjar pranowo mahfud md suara adil didik program keluarga miskin sarjana;Negatif
program keluarga miskin sarjana nyata ganjar pranowo cipta sumber daya manusia unggul indonesia sukses jalan ubah noirok;Positif
ganjar pranowo mahfud md bukti politik kuasa harap ubah hidup bijak cerdas;Positif
ganjar pranowo ajak bersamasama agen ubah anak milik akses capai impi;Netral
haru ganjar pranowo ubah alam pribadi solusi konkret miskin;Negatif
semangat ganjar pranowo lawan miskin didik benarbenar inspirasi;Positif
ganjar pranowo mahfud md ajak agen ubah didik;Netral
semangat pokok ganjar;Positif
ganjar pranowo mahfud md buka pintu sempat generasi terus prestasi;Netral
program keluarga miskin sarjana gambar komitmen ganjar pranowo cipta ubah nyata;Negatif
ganjar pranowo mahfud md ajak cipta bangsa cerah didik;Positif
calon pimpin milik jiwa toleransi semangat mohmahfudmd moga mnang ganjarsikatkorupsi hebat mahfud;Positif
ganjar pranowo bukti pimpin jabat ubah positif program contoh nyata dedikasi;Positif
ganjar pranowo bukti didik kunci capai tuju hidup;Netral
ganjar pranowo ganjar penting perlu rakyat warna desa muncang syukur hebat mahfud;Positif
kangesanng christi mohmahfudmd hebat mahfud;Positif
ganjar pranowo mahfud md solusi nyata buka peluang didik anakanak miskin pinggir;Negatif
ganjar pranowo ajak peran aktif atas tantang miskin didik;Positif
wiyana bahrawi kait survey survey terjun bebas sama serah yang takdir prabowo enggak menang terus ini masalah adil;Positif
ganjar pranowo ajak gandeng tangan bangun jembatan didik inklusif;Netral
ganjar pranowo mahfud md bukti pimpin sejati tuju sejahtera rakyat;Positif
semangat ganjar pranowo dorong positif orang juang lawan miskin;Negatif
ganjar pranowo bawa semangat rangkul angkat potensi anakanak miskin program keluarga miskin sarjana;Negatif
dukung ganjar pranowo mahfud md dukung cipta generasi terus tangguh didik;Positif
ganjar pranowo mahfud md pimpin visi kuat bawa harap didik;Positif
arsjadrasjid mohmahfudmd keren ganjar dukung umkm kualitas enggak kaleng kaleng begini hebat mahfud;Positif
ganjar pranowo ajak bersamasama lawan miskin program keluarga miskin sarjana inisiatif butuh bentuk;Negatif
keluarga miskin sarjana cipta peluang anakanak miskin tumbuh kembang didik sesuai visi ganjar pranowo mahfud md;Negatif
ganjar pranowo mahfud md terus juang bijak dukung inklusivitas adil ekonomi digital;Positif
dukung penuh ganjar pranowo mahfud md pimpin paham investasi bidang didik kunci maju bangsa;Positif
ganjar pranowo bukti peka butuh masyarakat kunci bawa ubah positif;Positif
tetap semangat menang pasang ganjar mahfud;Positif
ganjar pranowo ajar hasil ukur gelar dampak positif masyarakat;Positif
dukung penuh ganjar pranowo mahfud md tempat didik prioritas utama;Positif
ganjar pranowo mahfud md bukti pimpin kuasa dampak positif;Positif
ganjar pranowo mahfud md bukti bijak cipta dampak positif;Positif
sukses acara bersholawat bukti ganjar pranowo mahfud md milik daya tarik luas hati rakyat;Positif
sukses ganjar pranowo mahfud md moga indonesia saksi ubah positif program keluarga miskin sarjana;Positif
visi misi ganjar pranowo tingkat sdm unggul tingkat sejahtera masyarakat ganjarpeduliekononinkri ganjarpeduliekononinkri vdeompeyf hebat mahfud;Positif
program keluarga miskin sarjana langkah konkret ganjar pranowo cipta generasi terus bangsa;Negatif
sistem di kampus harus dievalusi kait anak tuju sistem di hapus kampus menjegah dosen psikopat aniaya mahasiswa juang utriza didu bahrawi;Netral
ganjar pranowo mahfud md cipta momentum politik bukti peduli didik landas maju bangsa;Positif
ganjar pranowo mahfud md ajak bersamasama cipta indonesia inklusif adil didik;Positif
moga istimewa jogja jaga pasang ganjar mahfud menang;Positif
ganjar pranowo mahfud md tetap standar daya didik;Positif
ganjar pranowo mahfud md program keluarga miskin sarjana serius cipta ubah sosial didik;Negatif
ganjar pranowo mahfud md keluarga miskin sarjana buka pintu sempat anakanak miskin jago;Negatif
inspiratif ganjar pranowo ambil alam pribadi dorong cipta ubah positif program keluarga miskin sarjana;Positif
ganjar pranowo mahfud md pimpin wawas program keluarga miskin sarjana sukses jalan positif;Positif
berani ganjar pranowo atas tantang pribadi inspirasi orang program keluarga miskin sarjana;Negatif
ganjar pranowo mahfud md bawa semangat politik fokus sejahtera rakyat;Netral
keluarga miskin sarjana ganjar pranowo mahfud md harap keluarga capai sejahtera;Negatif
b usil dikit btw lambat selamat natal sehat sukses tahun presiden ganjar pranowo amin;Positif
ganjar pranowo sosok bukti juang didik rubah takdir;Netral
program keluarga miskin sarjana cermin komitmen ganjar pranowo hak didik anak indonesia kecuali;Negatif
moga langkah menang pasang ganjar mahfud;Positif
ganjar pranowo bawa semangat sama lawan miskin program didik rata kualitas;Negatif
acara konsolidasi menang ganjar mahfud ganjar pranowo cerita fenomena survei diotakatik percaya ganjar mahfud menang rakyat sama gaspol ganjar mahfud;Positif
berani ganjar pranowo mahfud md patut acung jempol luncur program revolusioner;Netral
ganjar pranowo mahfud md figur politik inspirator ubah positif;Positif
