stemming;Sentimen
salut ganjar mahfud yang capres yang sambut sri sultan orang hormat sambut orang hormat moga dlancarkan urus ganjar mahfud;Positif
suara langkah ubah mari pilih ganjar pranowo prof mahfud md pimpin bawa ubah positif sesuai nilainilai;Positif
ganjar pranowo gaspoll ganjar hebat mahfud;Positif
jogetjoget seru pemuda butuh program benar bantu pakai otak program ganjar pranowo;Positif
ganjar pranowo mahfud md harap maju indonesia program keluarga miskin sarjana;Negatif
dukung ganjar pranowo pimpin milik peduli didik blue;Netral
utami raharjo orang rakyat rakyat kok gaboleh;Netral
ganjar pranowo mahfud md pimpin milik visi tingkat kualitas sumber daya manusia didik sukses;Positif
ganjar pranowo pimpin kayak ganjar anakanak bahagia hebat mahfud;Positif
senyum lepas beban jalan;Positif
maturnuwun sabar izin ganjar singgah;Netral
ganjar pranowo rosiannahi masyaallah alam ganjar bnar buat oleng hebat mahfud;Positif
latar sederhana ganjar pranowo inspirasi orang hak raih citacita;Netral
program keluarga miskin sarjana solusi tingkat sejahtera keluarga ganjar pranowo mahfud md sukses;Negatif
iyaapa ganjar pranowo ganjar sosok rakyat hebat mahfud;Positif
ganjar pranowo bukti juang buah hasil didik;Netral
ganjar pranowo sosok tulus dedikasi sejahtera rakyat;Positif
i wb tni polri terus rawan bebas begitu pakai knalpot brong dunguuu;Negatif
calon presiden nomor urut usung pdip ganjar pranowo dukacita mati rawan kabupaten klaten;Negatif
ganjar pranowo didik bukti miskin takdir terima;Negatif
wejang yang sultan ganjar;Netral
dukung ganjar pranowo mahfud md pasang bawa ubah;Netral
ganjar pranowo pimpin dengar tindak sesuai butuh rakyat;Netral
terimakasih banget pakde ganjar sudah komitmen juang rakyat moga kontestasi pilpres menang program realisasi indonesia;Positif
alhamdulillah syukur panjat moga program unggul keluarga miskin sarjana solusi entas miskin perata ekonomi indonesia mantap dukung ganjarma;Positif
ganjar pranowo mahfud md bukti daya didik kunci capai maju zwad;Positif
moga program unggul realisasi kabupaten kota insyaallah ganjar menang;Positif
ganjar pranowo auliara suka banget lihat mobil keren pampang nyata karya anak bangsa hebat mahfud;Positif
ganjar pranowo program keluarga miskin sarjana bukti anak sempat;Negatif
kelak rskyat indonesia milik gelar sarjana lulus aku dunia;Netral
cipta sempat tara bidang didik apresiasi upaya;Netral
ganjar pranowo program keluarga miskin sarjana bukti didik kunci hasil;Negatif
airanireii ganjar pranowo amin moga surnur artesis sumber berkah warga muncang hebat mahfud;Positif
program vokasi jawa bukti serius ganjar pranowo cipta lapang kerja kurang angka miskin ganjar mahfud mari luas sukses;Positif
program cerdas anak bangsa sejahtera keluarga calon pimpin idam;Positif
hasil program vokasi jawa bukti ganjar pranowo pimpin libat rakyat proses bangun;Positif
narasi keren teddy hebat bela orang yang mbalelo partai nyabelajar jokowi;Positif
calon pimpin milik jiwa toleransi semangat mohmahfudmd moga mnang hebat mahfud;Positif
ganjar pranowo mahfud md pasang milik visi cipta indonesia cerdas unggul;Positif
alam pribadi ganjar pranowo inspirasi orang serah capai impi ganjar mahfud mari wujud impi indonesia;Positif
alus lek hebat mahfud;Positif
maturnuwun dulur sambut ganjar tengah hujan;Netral
prihatiutami ganjar pranowo sudah lihat banget anak cerdas sopan sederhana alam ganjar pikir bagus hebat mahfud;Positif
orang hebat ganjar sri sultan sukses semangat;Positif
dar temu momentum sejarah ganjar sri sultan satu bawa harap lanjut negeri;Netral
ganjar pranowo bukti didik tonggak hasil jangkau kalang;Positif
ganjar pranowo mahfud md terima kasih upaya nyata tingkat sehat masyarakat moga sukses;Positif
suasana akrab penuh hangat ganjar sri sultan kumpul momentum wujud sejahtera;Positif
program keluarga miskin sarjana langkah maju rubah paradigma masyarakat didik ganjar pranowo mahfud md moga sukses;Positif
hasil ganjar pranowo jawa modal jalan program tingkat nasional;Netral
alhamdulillah sowan raja jawa sri sultan hamengku buwono;Netral
ganjar sri sultan bagi visi bangun jalin kolaborasi;Netral
ganjar pranowo pimpin gugah semangat ubah rakyat;Netral
raharjo ganjar pranowo pimpin satu rakyat indonesia juang rakyat bela penting rakyat;Positif
ganjar pranowo mahfud md gambar didik fondasi bangun lanjut;Positif
moga wujud;Netral
harmoni bijaksana pancar temu ganjar sri sultan;Positif
program vokasi jawa bukti sukses konsep ganjar pranowo ganjar mahfud mari wujud hasil tingkat nasional npc;Positif
bellamy paham hapus twitnya om fitnah lo dosa jariyah jalan;Netral
program keluarga miskin sarjana solusi cerdas ganjar pranowo mahfud md moga langkah contoh daerah;Negatif
ganjar pranowo mahfud md terima kasih dedikasi cipta solusi nyata mari wujud ubah positif indonesia nely;Positif
ganjar pranowo mewah kelas banget kreativitas anak bangsa indonesia hebat mahfud;Positif
ganjar pranowo pimpin bawa semangat adil tindak ganjar mahfud pasang jaga adil rata penjuru tanah air;Netral
momen sejarah ganjar silaturahmi sri sultan gagas sinergi maju daerah;Netral
berani ganjar pranowo lawan miskin teladan pimpin mahfud md mari bahu bahu cipta indonesia sejahtera;Negatif
tvonenews ganjar pranowo sila mau jihad yang kemarin bela mati sampai mnolak israel piala dunia hebat mahfud;Positif
keluarga miskin sarjana depan taraf ekonomi didik indonesia unggul;Positif
menkopolhukam makan gaji buta;Negatif
ganjar pranowo bukti hasil juang keras didik kualitas;Negatif
sri sultan dukung ganjar mahfud;Netral
semangat ganjar pranowo lawan miskin apresiasi mahfud md mari dukung ubah positif negeri;Negatif
ganjar pranowo mahfud md pasang didik fondasi bangun sukses juang;Positif
moga program keluarga miskin sarjana harap untung ganjar pranowo mahfud md terus harap;Negatif
kota jogja sri sultan simbol sederhana ramah;Positif
erte bellamy tni hahahahaha muka kamu kayak benar ras banget orang enggak peduli apa tindak kalo sudah hilang nyawa wajib hukum enggak keras aku mah enggak juga;Positif
mpud menkopolhukam kapai makan gaji buta;Positif
hasil program vokasi jawa bukti ganjar pranowo pimpin inovatif;Positif
jogja istimewa terima kasih sambut ganjar sri sultan;Positif
kikidaliyo ganjar pranowo ganjar pimpin pasti hebat mahfud;Positif
ganjar pranowo pimpin paham investasi baik investasi didik;Netral
ganjar pranowo mahfud md terima kasih inisiatif positif program keluarga miskin sarjana langkah cerdas tingkat sejahtera;Positif
ganjar pranowo alhamdulillah terima kasih ganjar sehat hebat mahfud;Positif
visi jernih ganjar bimbing indonesia cerah investasi sektor didik;Positif
keren ganjar temu sri sultan jam yangg dagingg banget;Positif
ganjar pranowo pemuda indonesia milik potensi bidang industri kreatif mari bantu jadi impi nyata hebat mahfud;Positif
semangat dedikasi ganjar pranowo lawan miskin inspirasi ganjar mahfud wujud ubah positif indonesia;Negatif
support program paslon nomor urut ganjar mahfud;Netral
ganjar arsitek ubah didik komitmen hapus senjang didik;Positif
ganjar pranowo tokoh atas tantang didik ganjar mahfud pasang harap atas tantang tingkat nasional;Positif
ganjar pranowo prof mahfud md pilih daya masyarakat dukung didik wujud sejahtera mari jadi visi nyata;Positif
ganjar pranowo pimpin empat paham juang rakyat;Netral
investorfriendly pasang capres cawapres ganjar pranowo prof mahfud md kolaborasi rapat regulasi hukum dukung kembang investasi indonesia;Positif
maju ganjar semangat moga sehat;Positif
inspiratif ganjar pranowo bukti latar halang raih impi ganjar mahfud semangat ubah positif;Positif
inspirasi tindak ganjar gigih juang didik kualitas;Positif
ganjar pranowo mahfud md pasang bawa indonesia era maju;Positif
ganjar pranowo pimpin ubah nasib didik kualitas;Netral
program keluarga miskin sarjana langkah inklusivitas didik ganjar pranowo mahfud md sukses ubah;Positif
pimpin tempat tara rakyat jarak beliau akrab rakyat anggap saudara rakyat;Positif
utami raharjo nek tetap dukung gama;Netral
salut komitmen ganjar mahfud didik indoneesia mantap lanjut;Netral
ganjar pranowo dimanapaun kunjung sambut hangat masyarakat hebat mahfud;Positif
ganjar pahlawan didik pimpin juang tingkat sistem didik indonesia;Netral
ganjar pranowo bukti juang lawan miskin akses didik tara;Negatif
moga program benarbenar wujud;Positif
semangat lawan miskin milik ganjar pranowo dorong ubah positif ganjar mahfud cipta cerah;Negatif
ganjar pranowo mahfud md pilih bawa harap rakyat indonesia;Netral
ganjar pranowo beuhh mantap banget modif pakai hebat mahfud;Positif
ganjar pranowo beliau peduli didik cocok pimpin hebat mahfud;Positif
semangat ramah rakyat ini;Positif
maju semangat ganjar dukung serta;Netral
gusraharjo ganjar pranowo keren bro ganjar pranowo tuanku rakyat nomor wahid hebat mahfud;Positif
pimpin baik panutan bijaksana ganjar;Positif
ganjar pranowo mantap sukses ganjar hebat mahfud;Positif
ganjar pranowo mahfud md harap cipta iklim investasi kondusif tumbuh sektor usaha;Netral
wb tni polri kapoookkk;Netral
tweet fasilitas sila ayo debat bebas tema main lempar isu panas klarifikasi benar;Positif
anak muda ganjar pranowo bawa inovasi positif perintah;Positif
sama masyarakat ya ganjar;Netral
ganjar pranowo paham didik investasi baik bentuk;Positif
alam pribadi ganjar pranowo buat pimpin paham urgensi tingkat sejahtera didik ganjar mahfud mari juang;Netral
cak imin pkb bela gus dur sidang istimewa;Positif
kakfrey ganjar pranowo ideafestid semangat ganjar wujud kreatifitas anak bangsa maju hebat mahfud;Positif
program keluarga miskin sarjana solusi inovatif atas senjang sosial ganjar pranowo mahfud md sukses;Positif
ganjar pranowo tokoh bawa semangat dunia politik indonesia kalvin;Netral
ganjar capres sederhana benarbenar rakyat;Netral
ganjar pranowo mahfud md dukung program sehat progresif moga langkah maju bangsa fhm;Positif
fighter juang enggak bolej edit olok olok seperti jadi kemarin langgar hambaiknya ganti gb sebut nanti kamu ribut dunia enggak tahan jantung;Positif
seru banget kayak minep rumah warga terus tidur ruang tamu;Positif
hujan surut niat warga ketemu langsung ganjar keren banget sehat sehat;Positif
ganjar pranowo berani ganjar rasa langsung hidup kerja patut acung jempol hebat mahfud;Positif
sosok pimpin layan rakyat sederhana warga ganjar;Netral
ganjar pranowo wah ya doa baik ganjar hebat mahfud;Positif
moga sehat ya ganjar rekan rekan;Positif
nginap rumah warga sarap bareng warga erti paham langsung hidup masyarakat masa yang hadap warga bisa solusi baik joss gandos;Positif
ganjar pranowo mahfud md terima kasih komitmen tingkat sehat masyarakat moga sukses langkah;Positif
ganjar pranowo terus pionir bangun sehat desa puskesmas dokter visi inspiratif;Positif
ganjar pranowo pimpin komitmen bawa ubah didik ganjar mahfud pasang harap kukuh komitmen negeri;Netral
minep rumah warga ya ganjar;Positif
hey dukung amin merespon nama pribadi aniaya oknum tni rawan orang tinggal luka parah tindak;Negatif
ganjar pranowo ganjar langsung sosok yang sederhana hati hebat mahfud;Positif
ganjar pranowo mahfud md pasang bawa semangat maju didik indonesia;Netral
kikidaliyo ganjar pranowo tekad ganjar aktif promosi paham dalam nilainilai pancasila hebat mahfud;Positif
ganjar pranowo liciartia keren asli moga indonesia ruang anak muda kreativitas hebat mahfud;Positif
ganjar pranowo alhamdulillah atas terima kasih ganjar hebat mahfud;Positif
sama hangat nyata ganjar sang pimpin sederhana sua warga;Positif
alhamdulilah silaturahmi ganjar sri sultan;Netral
ganjar pranowo komentar mati rawan duga keroyok prajurit tni;Negatif
keren ganjar enggak salah pilih pimpin;Positif
ganjar pranowo terus komitmen sehat rakyat program desa puskesmas dokter langkah;Positif
warga rasa hadir ganjar pimpin kuasa dekat sederhana;Netral
ganjar pranowo mahfud md mantaps enggak bau kadrun hebat mahfud;Positif
kunjung ganjar kampung halaman warga momen penuh sama bahagia;Positif
ganjar pranowo mahfud md gambar hasil batas status ekonomi;Positif
nikmatulsg ganjar pranowo alam ganjar terus jaga semangat integritas hebat mahfud;Positif
jellicent ganjar pranowo tuju opini ganjar jabat layan rakyat hebat mahfud;Positif
ganjar pranowo moga air bersih sedia berkat bantu ganjar manfaat maksimal masyarakat hebat mahfud;Positif
ganjar pranowo teladan pimpin alam bukti didik raih impi;Netral
pimpin rakyat ganjar rasa hangat sambut warga unjung daerah;Positif
ganjar hati senang;Positif
ganjar pranowo tokoh ajar didik kunci sukses;Positif
sukses ganjar salam sehat nomor menang;Positif
ganjar pranowo bukti didik kunci buka pintu sukses pandang latar ekonomi ganjar mahfud lanjut semangat tingkat nasional;Positif
ganjar kunjung warga sambut senyum hangat antusiasme;Positif
sahabat rakyat turun tengah rakyat dengar keluh masalah masyarakat langsung yang ganjar laku;Negatif
terimakasih sudah boyolali salam damai;Netral
ganjar pranowo ganjar mahfud hebat mahfud;Positif
pandampamungkas ganjar pranowo salah tokoh hebat hebat mahfud;Positif
rnurdiantoro ganjar pranowo rosiannahi anak bapak hebat hebat mahfud;Positif
seru itu nginep rame rame obrol sampai enggak sadar larut;Netral
mneaning ganjar pranowo rosiannahi benar banget alam ganjar dewasa hebat mahfud;Positif
ganjar pranowo pilih ganjar ganjar manifestasi dukung pimpin yang berani diri lawan korupsi gratifikasi tingkat perintah hebat mahfud;Positif
dukung penuh ganjar pranowo mahfud md komitmen atas miskin program didik inovatif;Positif
ganjar pranowo prof mahfud md pilih pimpin arah negara pimpin penuh dedikasi peduli rakyat;Netral
calon presiden ri ganjar pranowo mahfud md regulasi hukum investasi mudah paham;Positif
program vokasi ganjar pranowo wujud komitmen nyata alternatif didik kualitas masyarakat;Positif
bospurwa ganjar pranowo norak yang datang kbnyakan ngarepin hadiah murni mndukung gp hebat mahfud;Positif
ganjar pranowo ganjar mah pahammm ya good banget hebat mahfud;Positif
ganjar pranowo ganjar pimpin nanti rindu hebat mahfud;Positif
ganjar pranowo mahfud md tandem bawa ubah positif bangun nasional;Positif
ganjar pranowo pimpin track record bagus bawa indonesia arah;Positif
pranowo hebat mahfud;Positif
ganjar pranowo selamat ultah nikah ganjar bu atikohsemoga allah kah keluarga ganjaraamiin hebat mahfud;Positif
ganjar pranowo mahfud md moga program contoh daerah atas miskin kinant;Negatif
bdoel ganjar pranowo seruanhl koteka nakula urrangawak dennisauya renahoston anda beliau wakil ganjar hebat mahfud;Positif
ganjar pranowo pimpin milik pandang bangsa;Netral
inspirasi jalan hidup ganjar pranowo harap ubah positif mari dukung ganjar mahfud wujud slmdst;Positif
ganjar pranowo program desa puskesmas dokter makna sejahtera rakyat dukung sepenuh mangan;Negatif
berani ganjar pranowo lawan miskin inspirasi;Netral
ganjar pranowo kreativitas pemuda aset rawat hebat mahfud;Positif
marissaauliaa anak muda pilih ganjar pranowo hebat mahfud;Positif
ganjar pranowo tekan jaga satu satu bangsa bangun jalan lancar ganggu hebat mahfud;Positif
pikir rakyat pilih ganjar hebat mahfud;Positif
acara konsolidasi menang ganjar mahfud ganjar pranowo cerita fenomena survei diotakatik percaya ganjar mahfud menang rakyat sama uang antusias semangat mereka terus bara;Positif
nichnach hebat mahfud;Positif
metode antiklimaks cari gimmic bosan lihat gimmic mulu;Negatif
anakkolong ri amin aman amin indonesia adil makmur;Positif
ganjar pranowo mantap dukung kreativitas pemuda maju negara hebat mahfud;Positif
ganjar pranowo sosok pimpin rakyat milik peduli didik;Netral
josephsumpadnor ganjar pranowo univpasundan pagar rakyat rakyat hebat mahfud;Positif
salah jenjang langit langit kalo memang bisa hindar bisa mungkin duaduanya;Negatif
ganjar pranowo moga beliau tempat baik sisi allah hebat mahfud;Positif
ganjar pranowo mahfud md pasang ubah wajah didik indonesia inklusif adil;Positif
cinta pimpin hujan halang;Positif
latar hidup ganjar pranowo yakin pimpin rangkul lapis masyarakat sukses ganjar mahfud;Positif
putus ganjar pranowo hadir bantu negara keluarga miskin program keluarga miskin sarjana terobos ganjar mahfud moga sukses;Negatif
kikidaliyo ganjar pranowo tuju banget pancasila pondasi kuat cumbuawf hebat mahfud;Positif
program vokasi ganjar pranowo contoh didik kalang hak orang;Positif
ganjar pranowo mahfud md harap indonesia maju adil;Positif
senang ganjar nginep rumah warga begini rakyat;Positif
ganjar pranowo teladan patut ikut pimpin hyunsung;Netral
ajak sahabatsahabat pilih ganjar pranowo prof mahfud md wakil butuh pimpin bawa harap cerdas langkah;Positif
chsitum johneliad ganjar pranowo iya kadrun kampret memang suka umpat hujat caci maki hebat mahfud;Positif
pandampamungkas ganjar pranowo ganjar panutan orang patut ganjar pimpin hebat mahfud;Positif
tentara salah dalam memang harus usut ajar tapi mohon juga jadi indak kampanye lagi motor knalpot yang diblombong kak;Negatif
ganjar pranowo rosiannahi alam ganjar keren hebat mahfud;Positif
ganjar pranowo pimpin rakyat penuh inovasi program keluarga miskin sarjana bawa dampak positif;Negatif
benjaminch dasalbantani ganjar pranowo mamatalkatiri amin serius nkh mah cayo ganjar hebat mahfud;Negatif
optimistis ganjar;Netral
ganjar pranowo nyaman menu pakai tiwol makan nasi kena diabetes hebat mahfud;Positif
utami raharjo mantap;Positif
anak muda ganjar pranowo mahfud md pimpin baik ketidaksetaraan ekonomi tanah air;Positif
hasil program vokasi jawa landas kuat ganjar pranowo mahfud md bawa ubah positif tingkat nasional;Positif
kisah ganjar pranowo tumbuh keluarga sederhana pimpin peduli miskin inspirasi ganjar mahfud mari cipta ubah positif;Positif
ganjar pranowo mahfud md harap bawa ubah signifikan negeri mari bersamasama dukung indonesia maju;Positif
hasusy ganjar pranowo alhamdulillah moga manfaat ganjar tulus layan masyarakat hebat mahfud;Positif
ganjar pranowo mahfud md pasang bawa ubah positif indonesia;Positif
semangat lawan miskin ganjar pranowo teladan ganjar mahfud mari bersamasama wujud ubah positif indonesia navate;Positif
bellamy anggota fpi mati kasus hilang;Negatif
ganjar pranowo mahfud md duo bawa semangat tata kelola negara;Netral
ganjar pranowo bahagia hasil gotong royong warga ganjar pranowo buat sumur artesis hebat mahfud;Positif
ganjar pranowo mahfud md representasi nyata pimpin milik komitmen kuat baik kondisi didik entas miskin sukses;Positif
ganjar pranowo mahfud md program keluarga miskin sarjana bawa dampak positif maju indonesia mari cerah vkwr;Positif
ganjar pranowo keluarga bahagia sempurna ganjar ganjar hebat mahfud;Positif
ganjar pranowo mahfud md pasang bawa semangat adil sosial didik;Positif
percaya program keluarga miskin sarjana ganjar pranowo mahfud md buka peluang anakanak indonesia untung;Negatif
program keluarga miskin sarjana langkah berani revolusioner inisiasi ganjar pranowo mahfud md;Negatif
dukung penuh ganjar pranowo mahfud md tokoh bawa harap cerah indonesia;Netral
hasil program vokasi ganjar pranowo inspirasi mahfud md inspirasi wujud tingkat nasional;Positif
pilih ganjar pranowo prof mahfud md pimpin milik rekam jejak tegak adil depan nilainilai manusia;Netral
nilai ganjar benarbenar rakyat sederhana;Netral
ganjar pranowo mahfud md tim jadi didik fondasi maju bangsa;Positif
program vokasi ganjar pranowo smk bukti didik solusi nyata kurang senjang ekonomi ganjar mahfud pilih cerdas;Positif
program vokasi ganjar pranowo peluang anakanak muda kembang potensi;Positif
hasil program vokasi jawa bukti ganjar pranowo pimpin milik visi mahfud md visi luas tingkat nasional nicetoo;Positif
wbening ganjar pranowo moga ganjar pranowo bangun indonesia menang milu hebat mahfud;Positif
program vokasi ganjar pranowo bukti nyata inovasi butuh atas masalah miskin ganjar mahfud terus inovasi;Positif
dukung penuh ganjar pranowo mahfud md didik kunci putus rantai miskin;Positif
ganjar sosok pimpin penuh kriteria;Positif
program vokasi ganjar pranowo solusi nyata tingkat terampil daya saing tenaga kerja mari dukung ganjar mahfud;Positif
mustamin tolak prabowo;Netral
ganjar pranowo mahfud md tandem dampak positif tingkat didik entas miskin urtypical;Negatif
sukses ganjar pranowo mahfud md moga program solusi nyata kurang miskin;Negatif
ganjar pranowo mahfud md tandem pancar aura ubah positif negeri;Positif
ganjar mahfud sinergi harap program vokasi ganjar pranowo bukti pihak penting rakyat;Positif
sri sultan pimpin ajar arti jaga lestari waris budaya generasi;Positif
pihak ganjar pranowo didik investasi cerdas mahfud md investasi hasil optimal rf;Positif
ganjar pranowo mahfud md tandem harap bawa indonesia puncak maju;Positif
warga yang iri mungkin desa orang iri heheheh;Netral
terima kasih mas guru bangsa pluralisme setia bar depan bela kebhinnekaan negeri cinta;Positif
ganjar pranowo alhamdulillah terimakasih ganjar moga baik kerja keras bawa manfaat rayat hebat mahfud;Positif
rencana program capres presiden hilang rencana program sebut;Negatif
ganjar pranowo mahfud md kombinasi kuat program keluarga miskin sarjana terobos positif indonesia;Positif
program keluarga miskin sarjana terobos harap rata sempat didik ganjar pranowo mahfud md dukung;Negatif
ganjar pranowo mahfud md pasang milik tekad atas tantang bangsa;Netral
inovasi ganjar pranowo libat perintah pusat jalan program keluarga miskin sarjana apresiasi ganjar mahfud harap;Negatif
anak muda ganjar pranowo simbol ubah positif;Positif
moga ganjar pranowo mahfud md wujud visi entas miskin program keluarga miskin sarjana inspiratif renosrgr;Positif
vonnycornellya hebat mahfud;Positif
ganjar pranowo bukti sederhana kurang kapasitas ubah positif ganjar mahfud mari wujud adil sejahtera;Positif
program keluarga miskin sarjana langkah konkret sempat adil ganjar pranowo mahfud md garda depan ubah;Positif
pimpin adil inklusif sri sultan cipta atmosfer harmonis jogja cipta nyaman;Positif
pihak ganjar pranowo keluarga miskin contoh nyata peduli pimpin nasib rakyat mahfud md jaga luas peduli meat;Negatif
anak muda ganjar pranowo mahfud md katalisator dorong sektor industri kreatif;Positif
ganjar pranowo mahfud md pimpin tekad kuat hapus senjang didik indonesia;Positif
semangat ganjar pranowo mahfud md lawan miskin pilar ubah positif negeri;Negatif
ganjar pranowo sosok integritas dedikasi maju bangsa;Netral
ganjar pranowo bukti latar ekonomi halang capai didik mahfud md cerita sukses;Positif
jellicent mohmahfudmd semangat ganjarsikatkorupsi lanjutgansemuamurah lanjutgansemuakerja hebat mahfud;Netral
libat ganjar pranowo program vokasi bawa ubah positif jawa mahfud md ubah luas tingkat nasional;Positif
program keluarga miskin sarjana langkah progresif tara adil ganjar pranowo mahfud md mari bersamasama cipta;Positif
ganjar pranowo ramah ganjar bahagia hebat mahfud;Positif
hasil ganjar pranowo atas miskin didik inspirasi pimpin dukung penuh ganjar mahfud tta;Negatif
semangat ganjar pranowo cipta lapang kerja program vokasi apresiasi ab;Positif
didik kunci emas ganjar pranowo bukti nyata denno;Positif
program keluarga miskin sarjana langkah konkrit cipta sempat tara anak indonesia ganjar pranowo mahfud md wujud r;Negatif
program vokasi ganjar pranowo buka jalan anakanak muda milik karir mahfud md aman tingkat nasional;Positif
samarchitect hebat mahfud;Positif
ganjar pranowo sumpah keren banget hebat mahfud;Positif
ganjar mahfud tandem harap program vokasi ganjar pranowo solusi cerdas cipta lapang kerja albar;Positif
sehat aset harga terima kasih ganjar pranowo program desa puskesmas dokter prorakyat;Positif
sukses ganjar pranowo program vokasi contoh nyata didik praktis buka pintu sempat ganjar mahfud terap indonesia;Positif
ganjar pranowo mahfud md anak keluarga miskin kendala raih citacita;Negatif
program vokasi ganjar pranowo bukti didik alat efektif ubah nasib;Positif
ganjar pranowo bukti anak keluarga miskin potensi sarjana sempat ganjar mahfud mari bangun cerah;Positif
ganjar pranowo bukti didik vokasi ubah nasib mahfud md bawa ubah tingkat nasional;Positif
chotimah ulama kosong cuap cuap ajak ahodakih langsung contoh kamu enggak faham bokek sama qodari;Negatif
sri sultan sosok pimpin bijak inspirasi positif orang;Positif
dukung penuh ganjar pranowo mahfud md milik komitmen ubah positif alyssia;Positif
program keluarga miskin sarjana jalan inklusivitas didik usung ganjar pranowo mahfud md;Negatif
kikidaliyo ganjar pranowo butuh pimpin ganjar visi misi rawat pancasila hebat mahfud;Positif
program vokasi ganjar pranowo bukti didik praktis buka pintu sempat mahfud md norma negeri;Positif
mari bersamasama dukung ganjar pranowo prof mahfud md butuh pimpin cerdas intelektual tulus peduli nasib;Positif
investor get ready pasang capres cawapres ganjar pranowo prof mahfud md gas tuntasin regulasi hukum betah indonesia;Positif
program keluarga miskin sarjana cipta harap keluarga pinggir ganjar pranowo mahfud md moga sukses;Positif
pilih dukung ganjar tulus pakai hati sejahtera rakyat;Positif
ganjar mahfud moga indonesia maju daya programprogram inovatif ganjar pranowo keluarga sarjana;Positif
program keluarga miskin sarjana bentuk peduli nyata tara didik ganjar pranowo mahfud md dukung;Negatif
saksi juang ganjar pranowo lawan miskin harap moga mahfud md indonesia ubah positif signifikan sebonglovers;Positif
wereng bagus hormat siaapun;Positif
ganjar pranowo bukti latar halang prestasi mahfud md harap indonesia wannahwan;Negatif
hasil program vokasi ganjar pranowo modal luas akses didik negeri mahfud md bantu realisasi;Positif
program keluarga miskin sarjana nyata ganjar pranowo mahfud md tantang sosial;Negatif
ganjar pranowo mahfud md pimpin paham atas miskin didik fondasi utama;Negatif
program vokasi sukses jawa bukti ganjar pranowo pimpin cipta solusi lanjut ganjar mahfud mari lanjut prestasi tingkat nasional;Positif
