stemming;Sentimen
februari rakyat pilih ganjar mahfud pasang ideal yang rakyat;Positif
pilih ganjar mahfud indonesia anti korupsi pro rakyat;Positif
februari kertas suara abu abu coblos nomor ganjar mahfud gentar pilih ganjar takut pilih mahfud;Negatif
nanti puter kenang bagaimana juang bapak milu pokok;Netral
live harap juta rakyat semarang;Positif
gue kubu belah lihat program rekam jejak ganjar benar benar mantap pilih;Netral
ganjar sosok sersan serius santai pilih pilpres;Negatif
basmi manusia busuk yang suka adu domba anak bangsa;Negatif
maturnuwun terimakasih kang ajak silaturahim;Netral
dumdum arek arek jangan pol dablek udan petir sambar nyambar udan angin deres banget tetap setia pesta rakyat sing sono ngomah sidoarjo tonton udane wis ngeri broo;Negatif
sulawesi utara indonesia nurani bicara;Netral
saya amat beliau tetap bagai capres banding capres beliau yang lengkap alam mantan aktivis campus aktif organ tahun legislator tahun bagai gub paham kelola anggara;Positif
bismillaahirrahmaanirrahiimi nawaitu bangun negeri;Netral
sorry sorry;Negatif
surveydunia halu lihat dunia nyataa;Positif
gaung menang sulawesi utara indonesia;Positif
minimal juta suara dukung setia btp dukung ganjar mahfud;Negatif
sulawesi utara cerita kirim pesan menang pelosok indonesia gentar takut pilih ganjar mahfud;Negatif
ganjar pranowo blusukan pasar tomohon kamis sambut antusias dagang masyarakat;Netral
air susu balas air tuba baik balas jahat gila perilaku keji;Negatif
dengar usaha senior;Netral
ganjar mahfud menang;Positif
door tapi door sedang korwil sumbar sekitar jalan dikoto tangah kota padang sedang kampanye ganjar mahfud masyarakat;Netral
ganjar mahfud komit salam janji jari taat tuhan patuh hukum setia rakyat;Positif
orang cerdas pilih ganjar mahfud;Positif
pimpin istri suporting system sang suami dan keluarga ning atikoh dadak juru lampu ganjar live video putra mas alam;Positif
projo ganjar panglima tni tindak laku aniaya rawan ganjar mahfud;Negatif
mundur jalan kamu sudah payah pakai ting;Netral
resolusi indonesia unggul dukung ganjar mahfud pantang mundur menang ganjar mahfud;Positif
indonesia unggul dukung ganjar mahfud pantang mundur menang ganjar mahfud;Positif
ri program makan gratis;Positif
yang menang survey tunggu sujud syukur deklarasi;Positif
pilih ulama salah abuya muhtadi dukung ganjar mahfud pilpres insyaallah pimpin indonesia sejahtera;Negatif
bungherwin jims alaya opa gaspol abah selamat;Netral
selamat;Positif
orang benar sakit lanjut kalo sanggup pikir waras dukung dadak miring sudah sudah maklum moga hidayah;Positif
keren paslon jago gua;Positif
thia lihat yang menang hambat hebat apa tenang menang;Positif
data tani bantu pupuk suluh sampai ada asuransi gagal panen adalah program yang dorong minat masy gen saja milenial harap guys ayo semangat dukung indonesia lebih unggul;Positif
rapat baris lawan cawe cawe mas mas presiden bersahwat kuasa periode gaspoolll semangat;Positif
emakemak ntt gasspool ganjar mahfud;Netral
unggul telak;Positif
bingung deh pilih mas alam oyen iya samasama lucu;Negatif
keroyok rawan capres cawapres ganjar pranowomahfud md boyolali oknum prajurit tni cipta heboh;Netral
jokowi takut kantor pos tutup pas kirim duli deh;Negatif
mandom insyaalloh;Positif
semangat siang insyaalloh bayu wibowo arifin apa ffb;Positif
bears import nanam singkong mati di food estate susu persen import makan piring makan gratis sendok;Positif
mandom tenggelam insyaalloh;Positif
bahrawi import sapi perah bang kasih sekolah sekolah siswa siswa langsung minum susu segat ajar buang kotor sapi bagaiman ide contoh samsul;Positif
salut peduli ganjar masyarakat indonesia tani program beliau data ptani ganjar bantu tani maju usaha;Netral
anda capres belah nginep rumah warga cilincing jamin masuk angin sadar eyang sepuh tenaga kurang;Negatif
kerja keras senang paslon gagal putar makan gratis;Positif
mari satu kontribusi wujud;Netral
momen mas alam main bola bareng anakanak pantai seru banget;Positif
seru mas alam bersamasama sepeda ontel keliling surabaya;Netral
moga adil netralitas landas ambisi politik bingung;Positif
iring ceria hangat jalan nyekar makam momen lupa;Positif
kecewa sikap jokowi akhirakhir pilpres moga;Negatif
insyaalloh;Positif
dukung penuh anak muda ganjar mahfud presiden wakil presiden;Positif
ganjar ikhtiar orang biaa niruin ganjar ganjar ngedance kayak begitu loh;Positif
mundur wir calon negara siti atikoh;Netral
insyaalloh casanofa agoest ffb;Positif
anjar komitmen kuota gratis sekolahsekolah pilih presiden;Positif
insyaalloh sauya;Positif
acara pas gr ngawi sepi woi;Positif
intimidasi;Netral
sedekah wokowkaka;Netral
subsidi pupuk kurang proyek food estate biar;Negatif
insyaallah doa abuya muhtadi ganjar mahfud diijabah allah swt;Positif
ganjar pranowo mahfud md hukum tegak sikat korupsi;Netral
garda depan maju pesantren santri;Netral
poling metro televisi dominasi buzzer ndasmu etik cekot ndasse;Netral
santri excited ganjar ponpes kyai resah tani ditanggpi mas ganjar turangga haryanto;Positif
bu atikoh peduli ajar santri turangga haryanto;Netral
sekolah ganjar mensejahterahkan santri pondok pesantren ajar turangga haryanto;Netral
ganjar mahfud indonesia jaya visi misi;Netral
topgan pasu pingquin debat yang usik moderator;Netral
ganjar pranowo pimpin bawa maju indonesia;Netral
apa ada ganjar mahfud pilih sat set;Netral
mbulet junjungsnmu;Netral
wadowww yang lihat nyontek;Positif
insyaalloh top gan;Positif
keren keren keren gas pooll ragu debat kali;Positif
mantap top gan insyaalloh;Positif
ottis makmur bungherwin muba nakula robin jam win gaspolll insyaalloh;Positif
mari luluh lantah sombong sikap jumawa narasi putar narasi aklamasi cuihhhhh jalan terus;Negatif
sosialisasi calon presiden emakemak surabaya camat genteng gubeng bubut;Netral
mantap ganjar solusi masalah indonesia;Positif
ganjar mahfud cerdas pintar adil gerak cepat rakyat;Positif
pikir sudah ganjar mahfud menang sat set;Positif
dela krova lurah jelang sore abah terima kasih sudah;Negatif
didik anak prajurit bhayangkara ganjar mahfud hebat;Positif
sepakat sekali insyaalloh dela krova lurah ffb;Positif
biasa propaganda mah insyaalloh istikamah tweet apa jamur;Negatif
bahaya ta insyaalloh;Negatif
insyaalloh nusantara;Positif
modernisasi senjata tni ganjar mahfud hebat;Positif
coupling insyaalloh coupling;Netral
assalamualaikum wr wb semangat pagi selamat aktivitas moga aktivitas diridhoi kah allah swt sakit sembuh insyaalloh;Positif
mayoritas rakyat indonesia dukung ganjar mahfud menang;Netral
pilih semangkin mantap;Netral
insyaalloh milu;Positif
semangat malam insyaalloh cim arie ffb;Positif
ganjar mahfud hasil gambar tara integritas politik bebas aktif sukses menang percaya masyarakat jalan menang ganjar mahfud menang;Positif
terobos ganjar mahfud jamin butuh dasar prajurit langkah sistem tahan tangguh adil ganjar mahfud menang;Positif
sejahtera prajurit tangan ganjar mahfud fondasi kuat tahan negara mari bersamasama menang ubah positif ganjar mahfud menang danyus;Positif
tegak adil sistem tahan ganjar mahfud layak dukung penuh ganjar mahfud menang;Positif
order mana bang order biji ketemu;Netral
tubuh sehat jiwa kuat dua pimpin paket komplit yang butuh indonesia wujud bonus demografi;Positif
terima kasih sudah papar sangat;Positif
rin mantap bah;Positif
aqeeda fajar formee hatur nuhun bah;Netral
selamat malam insyaalloh rin ffb;Positif
insyaalloh tapi afifah baelah pjilat ffb;Netral
insyaalloh aqeeda fajar formee ffb;Netral
insyaalloh chotimah;Positif
konsistensi ganjar mahfud jaga pangan aman patut apresiasi dukung pangan nasional aman murah surut ganjar mahfud menang;Positif
pangan aman harga enak kantong visi nyata ganjar mahfud dukung luntur pangan nasional aman murah ganjar mahfud menang;Positif
ganjar mahfud duo berani positif menang pangan nasional aman murah ganjar mahfud menang urflo;Positif
dukung ganjarr mahfud;Netral
mantab ganjar papar blas sesuai data alam keren capresku;Positif
strategi maleng teriak malengmau tangkap maleng;Netral
alas rahasia negara;Negatif
panas suasanacukup pilih nomor saja;Positif
hak suara jepang abu ubaidah wadas slank buzzer benar saja minggu barca;Positif
moga menang february;Positif
sejati milu cegah orang jahatberkuasa;Negatif
tweet rombong cendana otomatis masuk;Netral
tanggap ganjar kait bumn milik anak usaha negara cari uang negara fasilitas;Netral
surodiro joyoningrat lebur dening pangastuti;Netral
upaya harap rangsang regenerasi tani inspirasi generasi muda pilih profesi tani;Netral
seru aldi taher sempat senayan riah pesta demokrasi tema bapa indonesia butuh ganjar mahfud;Positif
penguin seliwerun jakarta lari cinta ganjar seru penuh semangat indonesia kuat indonesia unggul;Positif
indonesia butuh pimpin enerjik stamina kuat sandiaga ganjar penguin sliwerun warga asyik sekat;Positif
strategi harap bantu umkm kelas peran aktif bangun ekonomi;Negatif
ganjar anak muda milik khawatir bidang ekonomi kreatif;Positif
pedhet puja hidung mancung ngelebihi truk sungguh;Positif
ayo tambah miltan bagi kaos;Netral
dhimas gass up;Netral
pasar mahfud sekarkinanthi bonjav http;Netral
bonjav mahfud pasar sekarkinanthi;Netral
bonjav pasar mahfud sekarkinanthi;Netral
bansos uang pribadi jokowi bansos pajak rakyat yang kembali rakyat;Positif
cocok;Positif
mahfud pasar sekarkinanthi bonjav;Netral
ogi bisa;Netral
ganjar mahfud presiden wakil presiden pasang rakyat atikoh ceria ramah sederhana nyaleg pakai tas hermes sendal louis vuitonrakyat butuh dekat tonton mewah;Positif
saya salah satu yang pilih daripada jkw kali pilih jkw pandang baik sekarang pilih pandang baik grup wa jkw pilih;Positif
mujani hasil tanding proses giring opini pilih tahu kosong menang ok;Positif
insyaalloh sena glenn sauya alamsyah ffb;Netral
insyaalloh abubakar boy jims ffb;Netral
insyaalloh ynwa ermi ffb;Netral
sikap rakyat sabar temu dengar merespon risau contoh pimpin amanah damba;Netral
ganjar bu atikoh bucinnya langgeng banget;Netral
banget mas alam pantas eca tempel deh;Positif
alam ganjar pemuda prestasi penuh bakat pantas banget fansnya;Positif
bismillah presiden ganjar mahfud menang kamitidak pernahabuabu;Positif
prabowo pilpres prediksi putar dukung ganjar anies satu;Netral
gas poll ganjar pranowo presiden;Netral
mwantappp pooll ganjar mahfud menang kamitidak pernahabuabu;Positif
moga pilih presiden ganjar mahfud menang kitatidak pernahabuabu;Positif
masyarakat yang masyarakat butuh kitatidak pernahabuabu ganjar mahfud menang;Netral
ajak seruseruan enggak alay ya ganjar ganjar mahfud menang kamitidak pernahabuabu;Positif
indoonesia lanjut baik ganjar mahfud baik;Positif
semangat dengar keluh kesah masyarakat ganjar mahfud menang kamitidak pernahabuabu;Netral
begitu heboh sambut datang ganjar tunjuk betapa banyak yang dukung ganjar mahfud menang kamitidak pernahabuabu;Positif
sehat presiden ganjar mahfud menang kamitidak pernahabuabu;Positif
enak banget makan karena tani tani kamitidak pernahabuabu ganjar mahfud menang;Positif
emakemak antusias banget kak ganjar enggak diraguin hati kalang ganjar ganjar mahfud menang kamitidak pernahabuabu;Positif
me muba rapat baris satu suara ganjar mahfud menang kamitidak pernahabuabu;Netral
rakyat sosial ampmendengarkan keluh emak ganjar mahfud menang kamitidak pernahabuabu;Positif
kondisi negara butuh kerja konkret menang calon menang kalah calon kalah;Positif
emak jatuh hati ini ganjar ganjar mahfud menang kamitidak pernahabuabu;Positif
ganjar mahfud menang perhati keluh rakyat sembako yang harga kamitidak pernahabuabu;Netral
ganjar mahfud percaya berantas korupsi kkn nyata integritas penuhmasyarakat yakin;Positif
sikat kkn baik maka baik tempat jabat jabat tegak hukum adil baik sikap moral kuasa terap jabat suka hati;Positif
tagan ganjar mahfud milu dukung palestina kuat;Positif
bangun hidup kampus inklusif wadah agama dukung hmi;Netral
anak muda semangat patriotisme cipta lawan korupsi baik;Positif
ganjar hasil cipta instruktur fungsional estis;Netral
sila kritik suka;Netral
anak muda hati;Positif
sedang korwil sumbar canvasing door tapi door langsung masyarakat pauh kota padang jumat;Positif
capresmu segemoy gayeng seperti ketua;Positif
rakyat butuh pimpin kualitas kerja;Netral
nah yang putar;Netral
ganjar dukung palestina presiden;Netral
ganjar hasil bangun kamu jalan ragu;Netral
keren;Netral
jajal neng kene ngono pongor cocote raine model arek gatheli dukung sopo sak karepmu cok ojo ngapusi ngono mesakne seng sek waras;Netral
tweet tweet biar samsul begitu om wowo begitu lempeng jalan putar;Netral
tanya receh layak kembali moderator insyaalloh;Positif
ingkar janji;Netral
ganjar terima curhatan guru paud gaji langsung kaget janji adil guru paud ayo dukung ganjar bela pahlawan tanda jasa;Positif
sidoarjo siang pecah;Netral
insyaalloh thonie sena ffb;Netral
keren bandung jawa barat nih manteeb;Positif
asik asik riang gembiraa;Positif
bagi apk rompi kaos kalender dll sopir ambul posko ganesa jawa barat pakai posko ganesa usaha baik ganjar mahfud indonesia;Positif
gass poll orang pilih orang;Netral
ganjar mahfud unya solusi baik juta rumah rumah hasil rendah ganjat mahfud solusi;Positif
seulawah kopi makna aceh;Netral
muba nusantara cent min nakula rakyat;Netral
balik pria sukses wanita hebat ganjar atikoh bukti hadir mata publik coba check pasang paslon lainweeeeeeeehhh;Positif
program unggul bukti nyata komitmen ganjar mahfud md tingkat kualitas hidup lansia;Positif
kolaborasi hebat ganjar mahfud md lahir program lansia revolusioner hidup senang manula;Positif
program lansia karya ganjar mahfud md rancang penuh dedikasi sejahtera;Positif
misi ganjar mahfud md hadir program inovatif hidup lansia;Positif
ganjar mahfud md bersamasama rancang program lansia cipta tua penuh bahagia;Positif
lansia perhati khusus program cipta ganjar mahfud md hidup martabat;Positif
kolaborasi kuat ganjar mahfud md komitmen cipta program lansia bahagia;Positif
program unggul ganjar mahfud md hadir visi tua lansia;Positif
kolaborasi penuh semangat ganjar mahfud md usaha cipta generasi tua aktif sehat bahagia program sejahtera lansia;Positif
komitmen ganjar mahfud md susun program akomodasi butuh khusus lansia rasa sejahtera tua;Positif
program prolansia inisiasi ganjar mahfud md contoh upaya nyata tingkat perhati hidup lansia;Positif
lansia harap nikmat tua nyaman bahagia upaya kolaboratif ganjar mahfud md;Positif
harap ganjar mahfud md rancang program dukung fisik sejahtera emosional lansia;Netral
ganjar mahfud md kualitas hidup lansia tingkat program holistik lanjut;Positif
program tuju bahagia lansia jadi integral bangun sosial;Positif
ganjar mahfud md susun rencana komprehensif jamin hidup lansia masyarakat;Netral
program ganjar mahfud md tekad cipta lingkung ramah lansia nikmat tua layak;Netral
lansia perhati khusus program lopor ganjar mahfud md fokus aspekaspek hidup;Positif
bersamasama ganjar mahfud md susun strategi cipta iklim sosial dukung hidup lansia aktif bahagia;Positif
program sejahtera lansia rancang ganjar mahfud md tonggak bangun masyarakat peduli generasi tua;Positif
upaya tingkat sejahtera lansia ganjar mahfud md cipta langkahlangkah sambung;Netral
ganjar mahfud md gagas program prolansia hidup layak generasi senior;Positif
lansia fokus utama program rancang ganjar mahfud md harap hidup bahagia makna;Positif
penuh dedikasi ganjar mahfud md rancang program inovatif bantu lansia nikmat hidup nyaman;Positif
program gagas ganjar mahfud md tuju sejahtera lansia nikmat tua penuh gembira;Positif
kolaborasi solid ganjar mahfud md jalan cipta solusi bahagia lansia;Positif
visi ganjar mahfud md cipta program unik hidup lansia;Positif
ganjar mahfud md pimpin implementasi program komitmen kuat buka jalan tua lansia negara;Positif
sadar masyarakat peran lansia bangun hidup program;Positif
program ganjar mahfud md harap cipta budaya harga lansia masyarakat;Netral
program terap kerjasama aktif perintah sektor swasta lsm hasil maksimal;Negatif
mahfud md ganjar susun metode evaluasi ketat efektivitas baik lanjut program;Positif
dukung finansial fasilitas khusus integrasi program penuh butuh dasar lansia;Positif
program tuju latih terampil lansia sempat relevan kontribusi;Positif
tekan didik sehat lansia daya ambil peran aktif jaga sehat;Positif
libat komunitas lokal program arah cipta iklim ramah lansia daerah;Netral
ganjar mahfud md rancang mekanisme dukung psikososial lansia milik lingkung sosial dukung peduli;Positif
kelola sehat lansia fokus utama program layan sehat rancang sesuai butuh khusus lansia;Positif
program rancang inklusif lansia lapis masyarakat rasa manfaat;Netral
tuju utama program sempat lansia nikmat tua kualitas hidup optimal;Positif
lanjut program jamin masuk dekat holistik cakup aspek fisik mental sosial hidup lansia;Negatif
langkahlangkah konkret ambil rencana program lansia perhati butuh;Positif
ganjar mahfud md susun strategi program fokus aspekaspek hidup lansia sehat aman libat sosial;Positif
program visi tingkat kualitas hidup lansia bahagia tua;Positif
tekad kuat ganjar mahfud md rancang program khusus hidup generasi tua;Positif
program sejahtera lansia susun ganjar mahfud md tonggak perhati kelompok usia indonesia;Netral
ganjar mahfud md cipta fondasi kuat capai visi hidup lansia program progresif rancang;Positif
lansia kelompok lupa berkat perhati khusus program inovatif ganjar mahfud md;Positif
program sejahtera lansia rancang ganjar mahfud md solusi komprehensif tanggulang tantang hadap kelompok usia;Netral
kreativitas peduli ganjar mahfud md cipta terobos hidup lansia;Netral
lansia indonesia milik harap program cemerlang inisiasi ganjar mahfud md;Positif
upaya cipta masyarakat ramah lansia ganjar mahfud md rancang program fokus inklusi perhati butuh spesifik kaum senior;Netral
ganjar mahfud md pimpin ubah positif rancang program tanggulang fisik lansia perhati aspek psikologis sosial;Positif
program sejahtera lansia gagas ganjar mahfud md tanda peduli kaum senior indonesia;Netral
lansia indonesia perhati serius ganjar mahfud md gagas program revolusioner hidup generasi emas;Negatif
sama ganjar mahfud md cipta terobos upaya tingkat sejahtera lansia program rancang;Netral
semangat gotong royong ganjar mahfud md cipta program unik rancang khusus bantu lansia capai bahagia tua;Positif
ganjar mahfud md satu rancang program inovatif tingkat kualitas hidup lansia negeri;Positif
program lansia bahagia anak cucu gembira lansia perhati khusus dukung sejahtera;Positif
debat cawapres mahfud md gugah mikir demokrasi putus nyiapin panggung suara rakyat harga paslon;Netral
pantesan orang takut ngeri integritas komitmen indonesia bebas korupsi jawab;Negatif
selamat ulang mega sosok wanita hebat indonesia;Positif
indonesia tangan bangun gerak februari coblos juang;Netral
kampanye tatap muka dpc pdi juang kota manado dapil wenangwanea sabtu tempat kalimas sehat manado;Positif
nat kode tinggal tunggu ikhlas;Positif
kagum bangga cinta ulama erti baik pimpin bangsa sisi apa ulama mumpuni kah;Positif
amin kampanye putar;Netral
ciri khas orang medan sumut terus medan sambel kacang lezat orang sudah sejahtera nelayan ikan teri medan nikmat rakyat indonesia sehat gizi;Positif
kapuas hulu mayoritas;Netral
penuh cinta bulat tekad coblos ganjar mahfud pimpin berani seperti;Positif
indonesia once mekel feat yenny wahid;Netral
sri sultan sumber inspirasi orang;Netral
sri sultan senang datang ganjar;Positif
raharjo orang libur kayak respon;Netral
pesona kota jogja sri sultan hadir indah;Positif
ganjar pranowo semangat menyalanyala negeri;Netral
ganjar jalin silatuhrahmi sultan jogja;Netral
orang kagum ganjar sederhana pamer kaya jabat beliau usaha sapa dengar lapis masyarakat milik ikut setia;Positif
ganjar warga sosok pimpin rakyat;Netral
salut banget warga boyolali sambut ganjar antusias hujan sehatsehat;Positif
uni jogja lekang tawan;Netral
belum tapi kenapa;Netral
simatupang wb tni polri benar salah hajar benar;Negatif
ganjar pranowo mahfud md hasil cipta momentum positif tangan pinjol gabung cerdas arif lokal;Positif
penting rakyat ganjar;Positif
utami raharjo ganjar presiden indonesia kualitas kapabilitas mata dunia;Netral
moga program unggul ganjar mahfud keluarga miskin sarjana bantu rakyat moga bawa berkah;Positif
bismillah moga sesuai rencana menang depan;Positif
ganjar pranowo bawa canda harap;Netral
ganjar pranowo mahfud md bukti pimpin daerah pimpin nasional tangan;Netral
orang inspirasi inspiratif moga manfaat temu;Positif
cerita sayidina umar interogasi munkar nakirapa jawabanya dengan lantang keras menjawabapa teman dekat muhammad saw umar sombong kak;Positif
ganjar kota jogja istimewa;Positif
nama juga anak haram konstitusi sudah acak demokrasi negara yang mikat moe mikat dasar jilat mikir kau borjong;Negatif
ganjar dukung sri sultan;Positif
sosok pimpin harap rakyat;Netral
enggak nyata mending diam kau ajar bela apa buat dukung;Negatif
ohyaa titip salam pesawat bekas hibah bentuan kerja bilateral negara miskin barang bekas beli judul dpa menhan proyek ada pesawat bekas kah;Negatif
jogjakarta penuh cerita cinta mantaps ganjar;Positif
ganjar pranowo inspirasi generasi muda indonesia;Positif
ganjar pranowo alhamdulillah manfaat hebat mahfud;Positif
ganjar mahfud sosok pimpin terbai bangsa pokok mah;Positif
ganjar pranowo mahfud md duo hebat bawa indonesia negara ekonomi maju yukimi;Positif
sultan ganjar sudah sahabat temu;Netral
ganjar pranowo huahh semangat ganjar ganjar hebat mahfud;Positif
hebat ganjar pranowo mahfud md komitmen tumbuh ekonomi semangat;Positif
orang hak raih sekolah;Positif
me semua partai pada tapi ri mega hanya diwakilin hastosprtnya serius puankl saya perhatikankapan saya lihat puan blusukan kampanye sprtnya kampanye saya yang lihat;Negatif
moga jogjakarta all ini mas ganjar pranowo;Netral
capres nomor ganjar pranowo tipe pimpin pintar joget pimpin suka pikir kreatif;Positif
ganjar pranowo mahfud md inspirasi bijak bawa dampak positif langsung hidup masyarakat seharihari;Positif
ganjar pranowo mahfud md moga hadir bijak dukung kembang ekonomi digital adil aman rakyat;Positif
wiyana bahrawi advokat minimal paham tupoksi tentara polisi milik otoritas tegak hukum jalan raya main ranah aniaya wajib tindak tega;Negatif
mahfud md program unggul rakyat dar makan siang;Netral
program tingkat sumber daya manusia realisasi;Netral
ganjar pranowo mahfud md inspirasi kontribusi tumbuh ekonomi;Positif
joss sat set enggak tunggu presiden sekolah smkn gratis sudah sedia anak yang;Positif
jayasarmil putriaura ganjar pranowo ganjar pilih genz anak muda dukung ganjar beliau pimpin idam milenial hebat mahfud;Positif
dillarestu ganjar pranowo ganjar pakai mobil dinas ganjar dukung kreatifitas anak muda bangsa hebat mahfud;Positif
senang solidaritas warga desa senting kuat hujan;Positif
moga program realisasi;Netral
bagus program entas miskin;Positif
pilih baju daerah ganjar pranowo mahfud md sematamata tradisional cermin semangat ubah positif bawa dunia politik;Positif
pimpin ri alam yang lengkap integritas;Positif
jogjakarta kota penuh cerita ceria;Positif
tindak cepat ganjar pranowo mahfud md atas pinjol harap rakyat korban praktik usaha rugi;Positif
program bagus wujud;Positif
ganjar pranowo inovasi kreativitas pemuda aset harga bangsa ganjar dukung kreator muda karya pionir industri kreatif hebat mahfud;Positif
trisiyowong ganjar pranowo pimpin rakyat rakyat senang ganjar sosok pimpin hebat mahfud;Positif
foto lencana presiden lepas tolong presiden arti ri id didu;Netral
salam hangat jogja jogja all ini ganjar mahfud;Positif
chchotimah datuakrajoangek ganjar pranowo embung yang bangun paksa ujung penting politik kelompok hebat mahfud;Positif
ganjar pranowo wow mantap keren banget hebat mahfud;Positif
jogja istimewa istimewa jogja;Positif
bellamy tniau tni polri gila arogansi rawan sipil keroyok ramairamai oknum gaji pajak tugas tni bimbing;Negatif
tni kenalpot brong tni galak benar rak masak tni kelas kasus kelas kenalpot brong teroris kkb ngumpet;Negatif
regen wb tni polri benar iso bakar markase njijiki tenan og pilpres aparate mong manfaatke gawe kisruh wae asu tenan;Negatif
alas kubu prestasi anggota dpr ri pilih kali gubernur jateng beliau kalengkaleng alam politik perintah pilih cinta rakyat;Positif
istimewa jogja lepas peran sri sultan terima kasih kontribusi jadi jogja kota istimewa hati orang;Positif
songkem andisinulingga ganjar pranowo sila lho nikmat pandang main komunitas ayo yang kayak begini hebat mahfud;Positif
rizmaya anak lurah coba enggak anak lurah;Netral
mantap ganjar pranowo mahfud md duet janji tumbuh ekonomi mudamuda semangat;Positif
ganjar pranowo anak anak kecil sayang banget gp hebat mahfud;Positif
ganjar pranowo pimpin muda visi negeri;Positif
ganjar pranowo mahfud md tandem rumus solusi cerdas atas dampak negatif giat ekonomi digital;Negatif
dukung ganjar program jalan;Netral
temu moga wejang tambah spirit ganjar;Netral
sopan banget pas pilpres enggak gub jateng tanya ktp belagu;Positif
ganjar pranowo buka suara mati rawan duga keroyok prajurit tni;Negatif
ganjar pranowo mahfud md duo ajar transparansi ekonomi digital kunci hasil;Positif
ganjar pranowo mahfud md duo hebat kejar target tumbuh ekonomi ambisius;Positif
keren capres silaturahmi sri sultan hamengkubuwono moga manfaat njih;Positif
masyaallah moga niat buah hasil baik;Positif
mantap nihpilihan paslon;Netral
oh tanya internet gratis enggak wifi begitu internat batas enggak akses yang poor nomor asrama bebas tonton film bo keep alas dewasa cipta generasi;Negatif
ganjar pranowo mahfud md pasang harap hadir transformasi positif langkah mahfud tangan pinjol;Positif
moga program ganjar wujud dukung ganjar;Netral
dedikasi sri sultan jogja benarbenar bangga moga semangat inspirasi;Positif
