stemming;Sentimen
ganjar pranowo mahfud md tim harap cipta revolusi didik indonesia;Positif
kali sri sultan moga cipta kerjasama yang beliau;Netral
program vokasi jalan ganjar pranowo langkah konkret generasi muda hadap dunia kerja ganjar mahfud luas;Positif
iya ingat beliau yang tanggung lengser presiden;Positif
ganjar pranowo bukti didik kunci utama atas miskin program keluarga miskin sarjana bukti nyata komitmen ubah positif negeri;Positif
chotimah gus miftah sudah lupa sama profesi bagai ustadz muak lihat sudah harga;Netral
mahasiswa sbyk juta sedang sama juta luar juru orang missqueen juta tengah juta yang masalah ekonomi tengah sulit biaya kuliah biaya didik mahal juang;Negatif
juang dukung ganjar desa senting keren rela huja hujan suara dukung langsung;Positif
dengan smk gratis masyarakat lanjut didik yang layak;Positif
ganjar pranowo juang lawan miskin buka mata didik senjata ampuh;Negatif
program benar benar guna warga indonesia;Positif
bismillah ikhtiar bangun negeri;Netral
ikut follower;Netral
program vokasi ala ganjar pranowo cerdas tanggulang miskin ganjar mahfud duo harap ubah nasib bangsa;Negatif
ganjar pranowo kisah hidup bukti didik kunci sukses;Positif
gemas enggak sih tidur ruang tamu warga memang sehumble;Negatif
ganjar pranowo pimpin paham anak milik hak didik ganjar mahfud pasang jaga hak tara negeri;Positif
utami raharjo mbak kiki bagaimana ini;Netral
program keluarga miskin sarjana wujud peduli ganjar pranowo generasi muda;Negatif
bahrawi wiyana ganti bh ups ngeres bh begal hukum;Netral
orang hormat sri sultan sambut datang ganjar rumah;Positif
ganjar pranowo mahfud md pimpin pandai bicara pimpin tindak pilih ganjar ubah nyata;Positif
ganjar pranowo mahfud md gambar hasil gantung latar ekonomi chan;Positif
ganjar pranowo didik buka peluang anak raih citacita ab;Netral
hasil program vokasi jawa bukti ganjar pranowo pimpin visioner;Positif
suka terobos ganjar manfaat masyarakat anak muda;Positif
wagimandeep ganjar pranowo hebat mahfud;Positif
ganjar pranowo mahfud md duo inspirasi program keluarga miskin sarjana;Negatif
sehat apa ganjar lelah unjung rakyat orang semesta restu;Positif
ganjar pranowo kuat takut lawan;Negatif
bahrawi wiyana koordinasi bang tunggu tunjuk kakak bina takut keliru;Negatif
ganjar pranowo alhamdulillah sehat ganjar hebat mahfud;Positif
santai komennyakok kayak gibran nanggepinnya kurang awokwokwok oiya pakmending enggak usah bawa jkw lagi materi kampanyega move on pdip partai besarga andal sosok;Netral
semangat ganjar pranowo;Netral
ganjar pranowo mahfud md milik visi tingkat kualitas hidup masyarakat didik program keluarga miskin sarjana langkah nyata wujud visi;Negatif
bentar lagi yang lempar hengpong hebat mahfud;Positif
maaf profesi banci kaleng yang waras prihatin pantas capres belah dukung lgbt kawin jenis;Netral
airanireii ganjar pranowo heran ganjar dukung ganjar orang hebat mahfud;Positif
ganjar pranowo mahfud md bukti sejahtera rakyat prioritas utama;Positif
untuk netizen ganjar mohon enggak julid ganjar kunjung nginepnya rumah warga kampanye;Netral
ganjar pranowo mahfud md tandem bukti ubah nyata perhati didik;Positif
dukung penuh ganjar pranowo mahfud md buka peluang anak indonesia;Positif
ganjar pranowo teladan didik investasi baik;Positif
mahfud bellamy iki opo hubungane jal;Netral
mahfud md ganjar pranowo kombinasi nyala negeri;Netral
candi karya fantastis awokwokwok;Positif
husinshihab ganjar pranowo klaim lagu ubah masif malumalu hebat mahfud;Netral
ganjar pranowo pimpin dedikasi sempat tara ganjar mahfud duo wujud tara penjuru negeri;Netral
program suoaya anak indonesia tjnggi didik;Positif
ganjar favorit masyarakat moga ganjar menang;Positif
ganjar pranowo anak muda salah pilih dukung ganjar beliau dukung maju hebat mahfud;Positif
salut setia semangat gotong royong warga desa senting boyolali putus tidur ruang tamu temanteman contoh nyata pimpin rakyat;Positif
ganjar pranowo tokoh harap program keluarga miskin sarjana mahfud md rasa ubah positif negeri;Negatif
ganjar pranowo dewasa anak tulus ganjar hebat mahfud;Positif
asa pulang rumah selamat nikmat;Positif
ganjar pranowo bukti batas ekonomi halang raih didik mahfud md jadi prinsip indonesia;Positif
mahfud md ganjar pranowo sosok hati rakyat;Netral
salit saja apa ganjar penting rakyat;Negatif
sabar mas omong calon enggak laku takut biduren tidur dipan cilik;Positif
wb tni polri lah lapo ayo;Netral
sehat dukung;Positif
harga ikhtiar ganjar mahfud sempat didik tara anakanak indonesia program keluarga miskin sarjana patut apresiasi;Negatif
utami raharjo parah banget tuh;Negatif
sri sultan sumber inspirasi jogja istimewa berkat pimpin bijaksana dukung penuh harmoni lanjut;Positif
ganjar pranowo bukti anak milik potensi mahfud md potensi tempa didik;Netral
mari dukung apa ganjar apa mahfud unfuk laksana program jni;Netral
ganjar pranowo bawa ubah;Netral
ganjar pranowo mahfud md pimpin paham ayo pilih ganjar maju;Netral
beras asam sulfat;Netral
apa ganjar orang komitmen laksana;Netral
ganjar pranowo serius survei serius rakyat;Negatif
ganjar pranowo mahfud md harap anak indonesia hak akses didik tara;Positif
andreassolusi ganjar pranowo lihat sudah hasil ganjar bangga hebat mahfud;Positif
ganjar pranowo mahfud md bawa solusi cerdas lanjut program keluarga miskin sarjana;Negatif
ganjar pranowo kikiauliaucup kaesangp erinagudono pestapestapora sheilaon calon pimpin sederhanaaa hebat mahfud;Positif
ganjar pranowo mahfud md bukti didik fondasi capai bangun lanjut;Positif
yang tawur loyalis partai dukung salah yang;Negatif
bellamy memang sengaja bang heboh;Positif
ganjar pranowo dedikasi bawa ubah butuh dunia didik indonesia;Netral
ganjar pranowo dukung ganjar sampai garis final ganjar pranowo jaya jaya jaya hebat mahfud;Positif
taaiiiiii lah bohong;Netral
chotimah mundur jar paslon enggak mutu penuh haluan;Positif
kikidaliyo ganjar pranowo ayo mari dukung ganjar hebat mahfud;Positif
hormat sendiri ganjar capres izin unjung diam sri sultan;Netral
mashaallah program bawa berkah;Netral
ganjar pranowo mahfud md program keluarga miskin sarjana solusi cerdas entas miskin pintu didik;Negatif
ganjar pranowo masya allah warga bahagia nikmat air bersih program ganjar hebat mahfud;Positif
sapa ganjar pranowo bimbim slank next president bimbim pionir drummer slank blakblakan sebut ganjar pranowo next presiden story via;Netral
ganjar pranowo keren motif mobil hebat mahfud;Positif
ganjar pranowo fokus survei fokus juang;Netral
ganjar mahfud indonesia unggul;Netral
ganjar pranowo tokoh ajar hasil raih juang didik ganjar mahfud pasang ajar ajar anak bangsa;Netral
allah terimakasi sri sultan sambut ganjar kali mudah mudah tanda bagus;Positif
paket komplit indonesia ganjar pranowo mahfud md calon pimpin janji benarbenar tindak pilih ganjar indonesia;Positif
antusias warga desa senting patut acung jempol rela terobos hujan dukung ganjar;Positif
ganjar pranowo jarang menang tonton jaman mourinyok hebat mahfud;Positif
bismillah indonesia sri sultan hamengkubuwono inspirasi;Netral
program bantu keluarga cerdas hidup bangsaterimakasih ganjar mahfud;Positif
ganjar pranowo semangat padam maju hebat mahfud;Positif
ganjar pranowo adeknya sopan ganjar keren ayom anak hebat mahfud;Positif
mahfud md ganjar pranowo duo hebat rancang;Positif
sabar senang banget tamu ganjar;Positif
ganjar pranowo rakyat terus blusukan juang;Netral
alhamdulillah mudah mudah tanda ganjar presiden;Positif
ganjar mahfud memang hati programprogram salah sasar;Netral
jichhhu ganjar pranowo alfatihah moga beliau baik sis hebat mahfud;Positif
ganjar pranowo rakyat kau angka;Netral
jogja yang istimewa inspirasi ganjar mahfud;Positif
mantab ganjar mahfud lanjut realisasi program;Netral
dukung;Netral
wb tni polri mntap;Positif
ganjar pranowo ganjar memang hebat hebat mahfud;Positif
obrol seru daging nih sehat semangat ya berduaa;Positif
ganjar mahfud program pikir depan;Netral
aiiptu ganjar pranowo ganjar peduli rakyat cilik hebat mahfud;Positif
ganjar pranowo langsung terpanaaa pas lihat bangga pas hasil modifikasi anak bangsa hebat mahfud;Positif
ganjar pranowo rendah hati ramah nggih ganjar doa hebat mahfud;Positif
ganjar pranowo kreativitas batas keren unik ku hebat mahfud;Positif
ya ganjar dukung orang hebat;Positif
ganjar pranowo bawaslu usut gus miftah bagibagi duit;Netral
pqk ganjar erti harap dakyat anak sekolah sarjana dukung penuh;Netral
salut ganjar pimpin yang komitmen mensejahterahkan rakyat;Netral
nikmatulsg ganjar pranowo ganjar nu sinergi tuju ganjar harap nahdliyin hebat mahfud;Positif
tunggu tunggu warga miskin ganjar anak sekolah sarjana;Negatif
ganjar pranowo peduli survei peduli ubah;Netral
utami raharjo ganjar pilih ku;Positif
lega syukur pilih dukung beliau program beliau sasar;Netral
ganjar pranowo kreativitas kunci menang;Positif
keren banget sih capres yang loh gabung warga obrol dengar keluh kesah lihat dinamika hidup warga langsung mantul;Positif
ganjar pranowo inspiratif banget bukti juang pribadi bawa ubah;Positif
moga program keren realisasi;Positif
ganjar pranowo keren banget modifnya kreativitas anak indonesia hebat mahfud;Positif
rakyatmerdeka janji janji masif moga dongkrak elektabilitas nama usaha;Netral
takut bilang citra orang kenal publik citra;Negatif
gusraharjo teddgus ganjar pranowo prabowo ganja alam solusi kesempatam hebat mahfud;Positif
giselhansel ganjar pranowo kaesangp erinagudono pestapestapora sheilaon sudah harap mas alam karena keluarga sempurna hebat mahfud;Positif
bangga pimpin rakyat;Positif
ganjar pranowo butuh wadah yang perintah kembang hebat mahfud;Positif
dennysiregar prabowo perang lawan ganjar pranowo hebat mahfud;Positif
ganjar pranowo inspirasi kreativitas kampanye;Netral
hasil ganjar pranowo bangun sinergi perintah swasta cermin pimpin kolaboratif butuh;Netral
bismilah umr jateng munggah;Netral
mantap moga sarjana hebat;Positif
iri tanda;Netral
adindayulianti ganjar pranowo dukung kembang hebat mahfud;Positif
keren pikir ganjar program;Positif
ganjar pranowo blusukan ujung dunia keren;Positif
ganjar pranowo alhamdulillah jalan lancar hebat mahfud;Positif
ide program ganjar memang kaleng beliau hebat pikir efek;Positif
ganjar pranowo mahfud md percaya ubah pilih ganjar;Netral
ganjar pranowo gerak belakang;Netral
maksud;Netral
utami raharjo semangat ganjar mahfud;Netral
humble banget apa ganjar singgah mewah leseh bareng warga jadiii;Negatif
moga indonesia penuh sarjana yang hebat;Positif
bellamy hoax;Netral
tpn strategi menang ganjar mahfud kemas gimmick turut ganjar pranowo mahfud md usung pdip perindo hanura kemas gimmick;Positif
anak muda bangga calon pimpin ganjar pranowo dukung ganjar mahfud;Positif
ganjar pranowo kuat dukung;Positif
salah program baik ganjar mahfud;Negatif
temu obrol apa ganjar hujan halang semangat sambut luntur;Positif
chchotimah ganjar pranowo erickthohir alhamdulillah ganjar jadi president survei hebat mahfud;Positif
indonesia butuh sosok pimpin yang rakyat ganjar;Netral
program hasil sdm mantap ganjar;Netral
utami raharjo salut ganjar sudah begitu tetap sabar doain baik serang beliau;Netral
ganjar pranowo alamganjar kasih sayang ayah anak hebat mahfud;Positif
memang jual bos mu makan gratis penjara napi makan gratis;Positif
ketemu mana cob pimpin tidur bareng masyarakat ruang tamu pakai alas tiker apa ganjarr;Netral
utami raharjo masyaallah untung banget;Positif
pasuk coblos mari juang menang mas pranowo prof bersamasama visi citacita indonesia jaya;Positif
hasil ganjar pranowo tangan krisis sehat contoh nyata pimpin tanggap proaktif;Positif
kakakica ganjar pranowo moga pimpin yang depan hebat mahfud;Netral
gusraharjo ganjar pranowo tuju ganjar mahfud hebat mahfud;Positif
dumdum tni ancor kali hormat hansip;Netral
sempat emas keluarga indonesia milik sarjana;Netral
kikidaliyo ganjar pranowo benar banget yang beliau pancasila pondasi kuat negara hebat mahfud;Positif
semangat ganjar pranowo bukti orang baik benar dar formalitas;Positif
ragu bimbang pilih capres ganjar pranowo pimpin milu mahfud bawa kuat berani;Netral
paket komplit indonesia ganjar pranowo mahfud md pimpin butuh ajak orang pilih ganjar pranowo;Positif
gas wae pokok ra mangan gapuro;Netral
warga klaten juragan tikar nama ganjar pranowo;Netral
ganjar pranowo memang juang miskin program keluarga miskin sarjana benar mantap;Negatif
memang ganjar pimpin yang benar benar sederhana;Netral
tpn kenal aplikasi ekosistem digital ganjar mahfud;Netral
wb tni polri yang percaya berita manusia tolol yakali tni mukulin urus politik bginian yang percaya goblok banget gampang goreng buzzer merah;Negatif
ganjar pranowo lucu lihat interaksi ganjar anak bene benar sayang orang nyaman sehat terus hebat mahfud;Positif
ganjar pranowo sumpah keren habis ganjar anak muda jaman pintar hebat mahfud;Positif
program bagus manfaat rakyat;Positif
ingat kenang obrol bareng keluarga asi sampai malam tidur ruang tamu;Netral
ganjar pranowo pimpin inklusif cipta sama masyarakat;Netral
pandampamungkas ganjar pranowo rosiannahi dua ok hebat mahfud;Positif
wb arifin tni polri kono nek wani dok koyo opo tandang gawemu;Netral
maju ganjar mahfud;Netral
jellicent ganjar pranowo dana program kerja jalan hebat mahfud;Positif
moga silahturahmi jalin ganjar sri sultan;Netral
seru banget antusias senang banget datang ganjar;Positif
kikidaliyo ganjar pranowo pancasila terap bangun negara hebat mahfud;Positif
moga program cepat realisasi program bagus;Positif
wb tni polri drama;Netral
ganjar pranowo sehat sehat ganjar keluarga moga masyarakat hebat mahfud;Positif
ganjar pranowo pemuda kuat sejati bangsa mari ruang kreativitas bentuk cerah hebat mahfud;Positif
ganjar pranowo blusukan;Netral
gus dur phisik tiada tapi fatwa tausiyah tulis jokes dari pikir beliau tetap hidup dalam pikir rakyat ri dari brrbagai suku agamaamp golong seperti pahlawan diri bangsa lai ganjar ini syaa allah anugrahi ge;Positif
ganjar pranowo elektabilitasmu lejit wow;Positif
reshtua ganjar pranowo ganjar sosok tulus mantap hebat mahfud;Positif
ganjar pranowo khawatir survei khawatir hati rakyat;Netral
ganjar pranowo berita bantu masyarakat muncang bangun sumur artesis sedia akses air bersih hebat mahfud;Positif
utami raharjo semangat pakk;Netral
ganjar pranowo leseh seni mas ganjar seniman;Netral
capres ganjar pranowo nama jamin lanjut ubah positif pilih ganjar pilih;Positif
pasang ganjar pranowo mahfud md pimpin milik hati rakyat pilih ganjar indonesia adil;Positif
ganjar pranowo mahfud md harap program ubah paradigma didik indonesia;Netral
warga boyolali senang banget datang calon presiden yang harap;Positif
siticeriaselalu ganjar pranowo amin amin yang kencang dukung ganjar jadi ri hebat mahfud;Positif
gubernur cari citra gratis sekolah memang sekolah tanggung memang sekolah siswa memang jateng kurang si;Positif
ganjar pilih yang dukung presiden;Netral
gubernur klaten ganjar pranowo bawa guling janji;Netral
cathyprojek ganjar pranowo rosiannahi alam ganjar cerdas bapak hebat mahfud;Positif
ganjar pranowo ganjar mari tampil potensi kreatif indonesia imle hebat mahfud;Positif
ganjar pranowo memang jago bawa indonesia cerah;Positif
ceria ganjar warga desa dapat ganti;Positif
ganjar pranowo mahfud md cipta fondasi kuat bangun indonesia ubah positif didik;Positif
ganjar pranowo mahfud md terima kasih komitmen maju sehat tanah air moga langkah dampak positif;Positif
maturnuwun dulur terima kasih harga ganjar sambut hangat warga desa;Positif
lihat dekat ganjar warga tulus;Positif
van bunda lagi keliling door tapi door;Netral
terima kasih rakyat;Netral
program gambar ganjar pranowo mahfud md bicara tindak baik rakyat;Positif
ganjar pranowo semangat optimis sukses ganjar mahfud;Positif
ganjar pranowo representasi nyata pimpin inklusif peduli lapis masyarakat;Positif
presgan ganjar pranowo semangat motivasi pakk hebat mahfud;Positif
pimpin yang rakyat sederhana hanya ganjar;Netral
ganjar pranowo malam rakyat curhat bantal tikar curhat;Netral
ganjar pranowo inspirasi anak muda semangat indonesia ganjar mahfud;Positif
hasil ganjar pranowo bangun infrastruktur bukti kesiap pimpin bangsa;Netral
wb tni polri enggak tni main gebuk alasanjgn ngeyel tniatw pribadi;Positif
benar enggak dekne arep nginep omahe warga nak tidak arep nyalon biasa citra kampanye;Positif
ganjar sempat inap rumah masyarakat;Netral
bagus banget didik yang harap kualitas ekonomi baik;Positif
dukung ganjar gebuk boyolali kapuspen tni oknum periksa dpd partai golkar kota surabaya manfaat sisa milu via;Netral
program ganjarr bantu masyarakat lanjut didik;Netral
creamylatteoreo ganjar pranowo ganjar pimpin utama sejahtera rakyat salut banget pokok hebat mahfud;Positif
ganjar pranowo terimakasih ganjar pranowo atensi gerak cepat solusi atas sulit air bersih warga muncang moga sehat rakyat hebat mahfud;Positif
metrotv ganjar pranowo wakil dukung ganjar hebat mahfud;Netral
whyrd ganjar pranowo ganjar memang mantap hebat mahfud;Positif
alhamdulillah tunggu presiden langsung bantu;Netral
ganjar pranowo mahfud md paket komplit indonesia sederhana bijak indonesia maju ayo pilih ganjar;Positif
ganjar pranowo inspirasi agen ubah anak milik akses tara capai citacita;Netral
yogyakarta istimewa sejarah;Positif
wb tni polri pecat danyon;Netral
tweet buzernya main broo ngeleswes tampak banget seliwer;Negatif
kikidaliyo ganjar pranowo ganjar jaga rukun toleransi pecah belah indonesia hebat mahfud;Positif
prihatiutami ganjar pranowo keluarga ganjar keluarga nu hebat mahfud;Positif
nafertiti ganjar pranowo ganjar rakyat hebat mahfud;Positif
program keluarga miskin sarjana langkah cemerlang ganjar pranowo tangkal miskin;Positif
pasang ganjar pranowo mahfud md calon pimpin solusi pilih ganjar ubah;Netral
moga ikhtiar dijabbah allah nggih menang pilpres;Positif
anjlok dukung sibuk serang tapi yang dapat untung;Positif
ganjar pranowo pimpin yang cari rakyat hebat mahfud;Positif
ganjar pranowo pimpin harap ganjar solutif hebat mahfud;Positif
ganjar pranowo tukang janji tukang dengar;Netral
ganjar pranowo kayak ahli terapi dengar curhat;Netral
ganjar pranowo kaesangp erinagudono pestapestapora sheilaon ganjar ganjar partisipasi hebat mahfud;Positif
keren kali lihat calon pemimpiin tidur gelar rakyat;Positif
ganjar pranowo bawa tikar bawa janji politik;Netral
nikmatulsg ganjar pranowo dekat ganjar warga nu memang hebat mahfud;Positif
ganjar pranowo mahfud md rangkul anakanak prestasi keluarga miskin bawa angin segar daya masyarakat;Negatif
intruksi capres ganjar ella rosilawati bagi ratus telor santap tangerang lanjut intruksi capres ganjar pranowo ella rosilawati caleg dprd kab tangerang dapil sepat sepat;Netral
ganjar baik pokok salut ganjar sehat sehat;Positif
angkat keluarga tokoh adat jayapura ganjar pranowo ikat selempang noken mahkota khas papua;Negatif
ganjar pranowo berani bicara bukti aksi nyata programprogram keren drm;Positif
ganjar pranowo percaya program desa puskesmas dokter cipta ubah positif sehat masyarakat;Positif
apa akun medsos beliau capres presiden bawa asa njenengan lho padahal hina caci beliau dua dahsyat daripada njenengan;Negatif
keren lihat ganjar pranowo peduli banget nasib keluarga miskin moga program jalan lancar;Positif
salut ganjar rakyat banget tidur masyarakat;Positif
ganjar pranowo alhamdulillah terima kasih ganjar pasti air bersih manfaat warga muncang hebat mahfud;Positif
program keluarga miskin sarjana impi realisasi nyata salut ganjar pranowo;Negatif
iya program gp memang baik deh;Positif
seru turnamen mobile legends saga esports kawanjuang gp kabupaten bandung barat potret seru turnamen sabtu;Positif
mbak nong foto sangat dalem makna cinta cinta;Positif
dukung ganjar pranowo dukung bangun indonesia sumber daya manusia kualitas;Netral
wb tni polri parah;Negatif
ganjar pranowo mahfud md cipta solusi inovatif atas ketidaksetaraan didik indonesia;Positif
nendra bellamy presiden mu goblok;Negatif
wah ganjar satu calon presiden tidur bareng masyarakat;Positif
ganjar pranowo malam bantal tikar bintang tamu utama;Positif
jisatu ganjar pranowo kereennya ganjar nginap rumah warga sambung masyarakat hebat mahfud;Positif
panas dingin dingin panas tiru kau malu;Negatif
ganjar pranowo bangga deh lihat ganjar dukung kreativitas hebat mahfud;Positif
citra baik sejarah milu dunia;Positif
gusraharjo ganjar pranowo hayo baik ganjar golkar pilih kandidat wakil nilainilai visi partai efektif ganjar mahfud hebat mahfud;Positif
sauya kelompok orang kelompok lai pikir pandang yang beda iring kembang bangun tehnologi maju negara maju kembang negara but;Positif
kikidaliyo ganjar pranowo sosok pimpin junjung nilai pancasila pimpin ganjar hebat mahfud;Positif
tonton ayo pilih ganjar pranowo ubah positif;Positif
kapankapan buka klinik curhat ganjar pranowo dokter hati rakyat;Netral
alfaridzys ganjar pranowo ganjar pimpin erti rakyat hebat mahfud;Positif
utami raharjo tanggap bagaimana;Netral
utami raharjo mampir kayak kampung ganjar calon presiden;Netral
ganjar pranowo malam nginap kaya juragan tikar;Negatif
ganjar pranowo anak hati hebat mahfud;Positif
nakula sauya ganjar mnang;Positif
ganjar gaspoll tastes pokok;Netral
nakula sauya ganjar sakjos;Netral
ganjaranapp ganjar pranowo najwashihab ugmyogyakarta iya beliau ganjar solutif negara hebat mahfud;Positif
tweet pilih bodoh dibodohin bodoh pilpres usung demokrasi tapiya mayoritas pilih memang kalang bodoh dek;Negatif
nakula sauya gaspol gama mnang;Netral
kikidaliyo ganjar pranowo ganjar jaga pancasila sepenuh hati hebat mahfud;Positif
ganjar pranowo pilih pimpin indonesia program keren kayak begini;Positif
olahraga pagi blusukan pasar ganjar pranowo sapa dagang dengar keluh dagang harga pangan alami naik;Positif
utami raharjo saking sibuk mbak kiki enggak sempat lihat akun buzzer banget ngejelekin paslon;Positif
progam ganjar mahfud baik;Netral
sambut masyarakat moga lancar;Positif
ganjar pranowo terima kasih dedikasi desa puskesmas dokter moga wujud indonesia emas sehat;Positif
pimpin penuh agam ganjar pranowo representasi indonesia inklusif;Positif
lapak ganjar untung jual beli instrumen tumbuh ekonomi lokal;Netral
goes tapi samarinda bawa semangat dukung kembang umkm tingkat lokal;Positif
ganjar mahfud presiden peduli didik internet gratis;Positif
program hetero space bukti ganjar mahfud pikir pasar lokal milik visi bawa umkm indonesia saing pasar internasional;Netral
mahfud tabrak koruptor halang investasi;Netral
mahfud pandang luas banget infrastruktur enggak jalan doang atur teknologi;Positif
ganjar beri ikan buat jaring;Netral
program solusi indonesia ganjar;Netral
ganjar semangat hapus miskin keren banget;Positif
mahfud hukum keren guyon keren;Positif
ganjar mahfud harap tanah air cinta;Positif
dukung penuh mahfud komitmen cipta ekosistem ekonomi digital transparan pihak adil;Positif
ganjar mahfud tangan pinjol bijak holistik pimpin visi jangka amahardhika;Positif
sat set tas tes kunci ekonomi adil pimpin ganjar mahfud;Positif
dukung penuh ganjar atikoh md akses jamin hukum seluasluasnya rakyat moga langkah bawa ubah positif nyata;Positif
mas ganjar rakyat miskin bintang visi;Negatif
ganjar miskin malapetaka pilar hidup;Netral
mas ganjar obsesi hilang miskin misi;Negatif
goes tapi samarinda langkah konkrit bawa dampak positif umkm masyarakat lokal;Positif
ganjar sang selamat belenggu miskin indonesia;Negatif
tumbuh ekonomi bawa ubah positif sektor tani desa;Positif
inovasi ekonomi digital manfaat awas ketat mahfud sadar urgensi mumul;Positif
ganjar rakyat dukung henti juang;Netral
program makan solusi nyata;Positif
tumbuh ekonomi ganjar mahfud kunci hasil cipta lapang kerja;Positif
ganjar terus pelopor hapus miskin pacee;Negatif
ganjar mahfud terobos positif internet gratis ajar;Positif
hasil ganjar mahfud pinjol pimpin proaktif lindung rakyat potensi rugi;Netral
mahfud md sosok inspirasi ubah ayo dukung gera tabrak koruptor bangun ekonomi inklusif;Positif
ganjar mahfud calon presiden paham butuh anak muda;Positif
mahfud sih korupsi investasi kembang;Negatif
mahfud pesak odhengnya pesan pimpin lepas akar budaya;Positif
moga bentuk badan bantu hukum bawa ubah positif paham akses hukum masyarakat;Positif
bijak progresif ganjar mahfud bukti pimpin dampak positif laku umkm;Positif
hetero space program strategi ganjar mahfud bantu umkm capai standar internasional;Netral
jujur senang deh mahfud pikir infrastruktur segi fisik regulasi sampai bas digital;Positif
ganjar mahfud cermin satu dorong mandiri ekonomi digital;Netral
tumbuh ekonomi komitmen nyata pasang sejahtera rakyat indonesia;Positif
program langkah bijak ganjar pimpin;Positif
masyarakat dukung mahfud cipta bijak jembatan kembang ekonomi digital penting rakyat;Positif
rakyat miskin bangga mas ganjar pahlawan sejati;Positif
inovasi ecommerce lapak ganjar ganjar mahfud bukti komitmen wujud nol persen miskin ekstrem indonesia;Negatif
terima kasih mahfud peduli isuisu ekonomi digital moga langkahlangkahnya bawa dampak positif prayoga;Positif
rakyat senang lapang kerja lambai terima kasih mas ganjar;Positif
mas ganjar program cinta rakyat makan;Positif
ganjar pimpin hadir solusi janji;Netral
langkah perintah sungguh sungguh juang adil;Positif
mahfud md sosok dukung ganjar kuat;Positif
mahfudmas ganjar duo kocak lawan miskin stuff;Positif
ganjar inspirasi keluarga miskin harap ime;Negatif
mas ganjar program beda;Netral
mas ganjar obsesi hapus miskin inspirasi;Netral
ganjar mahfud usung semangat gotong royong bangun ekonomi ajak kontribusi;Netral
semangat ganjar bantu keluarga indonesia bangkit miskin;Netral
hetero space wahana laku umkm ajar kembang saing era ekonomi digital kompleks;Negatif
mas ganjar tokoh rakyat miskin hati emas sejati;Negatif
lapak ganjar platform inklusif cipta peluang tara laku umkm pandang latar skala bisnis;Netral
